주요 업무,자격요건 및 우대사항
에프앤엘의 인플루언서 마케팅 팀장은 플라이밀 브랜드와 제품들을 홍보판매할 수 있는 인플루언서를 발굴설득하여 인플루언서 마켓 및 PPL을 활성화하는 역할을 합니다 다양한 대내외 이해관계자와의 커뮤니케이션 스킬 영업력과 더불어 팀원의 퍼포먼스를 이끌어낼 수 있는 리더십이 중요합니다  인플루언서 마케팅 팀 관리 KPI 달성을 위한 전 과정 총괄 제품에 적합한 SNS 인플루언서유튜버 신규 섭외 및 마켓 진행 관리 인플루언서유튜버 콘텐츠 가이드 제공 인플루언서와의 소통을 통한 신규 브랜드제품 기획 방향성 도출, 인스타그램 or 유튜브 공동구매 관련 업무 경험이 3년 이상 있으신 분 뷰티 전문 MCN 벤더사와 직접 소통하신 경험이 있으신 분 논리적이고 적극적인 커뮤니케이션 스킬을 보유하신 분 적극적인 업무 태도와 끈기를 지니신 분 동시에 다양한 업무를 처리할 수 있는 우선순위 설정 역량이 있으신 분 2인 이상의 팀원 부사수를 이끌어본 경험이 있으신 분 가공식품 및 뷰티 카테고리에 대한 이해도가 있으신 분 평소 SNS 유튜브 채널의 인플루언서 및 그들의 컨텐츠에 관심이 많은 분 Slack Notion Gsuite 사용 경험이 있으신 분
 글로벌 웹 사이트 컨텐츠 운영 운영 업무 프로세스 기획 및 Service Request 관리 글로벌 웹 운영 프로세스와 웹 제작운영 가이드라인 배포 글로벌 웹 컨텐츠 운영 개선 방안 및 기획 운영 서비스 기획에 따른 서비스 런칭 및 후속 관리 운영 KPI 모니터링 각 국가별 운영 현황 파악 잠재 이슈 확인 및 운영 성과 개선 과제 실행 고객 커뮤니케이션 요청 사항 응대 관련 부서와의 협업을 통해 이슈 해결 지원 서비스에 대한 만족도 조사 PMO 업무 운영 현황 보고서 작성 주간월간, 컨텐츠 기획제작현지화 프로세스에 대한 이해 CMScontent management system 운영 경험 영어 커뮤니케이션 원활 이메일 커뮤니케이션 컨퍼런스 콜 진행 영문 보고자료 작성 PPTExcel 리포트 작성 원활 웹 사이트 확산 및 운영 경험 PMO 경험자 선호 퍼블리셔 업무 이해
 파트너사 온라인 프로모션 기획 및 실행 프로모션 성과 분석 및 보고 프로모션 운영 및 개선 활동 진행, 영어 능통자 대학교 졸업 이상관련 전공 우대 디지털 마케팅 온라인 플랫폼 관리 경험 1년 이상 다국어 능통자 구강스캐너 혹은 치과 업계에 대한 지식이나 경험 보유자 다양한 마케팅 툴 활용 스킬 ex Google Analytics CRM tools
 효과적 효율적인 마케팅 실행을 통해 미리캔버스 글로벌 유효 고객 수와 매출을 폭발적으로 성장시킬 수 있는 마케팅 업무를 담당합니다 다양한 마케팅 영역과 방법 중 강점이 있는 부분을 진행하고 그렇지 못한 부분은 팀원 외주 업체와의 협업을 통해 보완합니다  마케팅 영역  디지털 콘텐츠 소셜 미디어 SEO SEM ASO 이벤트 프로모션 가격 브랜드 등 린스타트업 방식 가설  실행  측정  학습으로 애자일하게 마케팅 업무를 진행합니다  역량과 희망에 따라 마케팅 챕터의 채용 훈련 코칭 등 리더십 역할을 담당할 수 있습니다 , 미리캔버스 글로벌 고객 수를 폭발적으로 성장시킬 수 있는 비전과 실행 계획을 깊게 논의하실 수 있는 분 원어민 혹은 비즈니스 레벨 이상의 영어 능력을 갖추고 계신 분 성공 경험을 바탕으로 미리캔버스의 성장을 위한 구체적이고 빠른 실행을 이끌 수 있는 분 외주 업체와 효과적으로 협업할 수 있는 강력한 커뮤니케이션 능력과 리더십이 있으신 분 마케팅 성과를 정량적으로 분석할 수 있는 데이터 기반의 그로스 마케팅 역량을 갖추신 분 만 7년 이상의 글로벌 마케팅 경험 성공했거나 급성장 중인 프로덕트 서비스에서 관련 업무를 진행한 경험이 있으신 분 창업 혹은 스타트업에서 주도적으로 업무를 수행한 경험이 풍부하신 분 미리캔버스 관련 도메인 업무 경험이 풍부하거나 지식이 있으신 분 온라인 디자인  프레젠테이션 제작 툴에 대한 비전을 고민해 보신 분 기술 제품 또는 서비스의 마케팅 경험이 있으신 분 다양한 마케팅 자동화 도구의 사용 경험과 외주 업체 협업 경험이 있으신 분 다양한 배경의 팀원들과 효과적으로 협업할 수 있는 강력한 커뮤니케이션 능력 및 리더십을 바탕으로 채용 팀원 육성 코칭 성과 평과 피드백 제공이 가능하신 분 마케팅 매니저에게 담당하는 서비스는 매우 중요하다고 생각합니다 여러분의 소중한 시간을 투자할 가치가 있는 미리캔버스인지 한번 더 고민 후 지원해 주세요
 글로벌 대기업의 닷컴 콘텐츠 기획CategoryPLPPDP    디지털 운영 전략 수립 및 콘텐츠 기획 업무 최신 트렌드 및 신기술을 적용한 창의적인 아이디어 도출 광고주 커뮤니케이션 , 디지털 콘텐츠 및 플랫폼 UXUI 관련 제반 지식이 있으신 분 디지털 환경 전반에 대한 높은 이해도가 있으신 분 적극원활한 커뮤니케이션 역량 광고대행사 경력 및 AE역할 경력자 우대 D2C기반의 마케팅 전략 수립 및 커뮤니케이션 방향성 수립 글로벌 디지털 콘텐츠 기획 or 글로벌 웹사이트 구축 or 글로벌 디지털 서비스 운영 경험 있으신 분 생활가전 및 TVAV산업에 대한 이해도를 바탕으로 뎁스 있는 고객 경험 설계 광고홍보학 신문방송언론미디어학 시각디자인 학과 우대 영어 능통자 우대 컴퓨터 및 MSOffice 어도비 프로그램 숙련자 우대
1 B2B 리드 제너레이션 목적의 콘텐츠 기획과 제작 신규 리드 확보를 위한 백서 뉴스레터 웨비나 기획과 제작배포 검색엔진최적화SEO에 대한 이해를 바탕으로 오가닉 사용자 상승을 위한 블로그 아티클 기획과 제작2 B2B 리드 너처링 목적의 마케팅 캠페인 운영 리드 퍼널 및 타겟 세그먼트에 따른 이메일 자동화 기획과 운영  잠재 고객 및 기고객 관계 관리 차원의 오프라인 이벤트 기획 및 실행 초기 세일즈 담당 부서와의 커뮤니케이션 및 협업 영업팀과의 유기적인 협업을 통해 계약 논의까지 기대할 수 있는 신규 기업 발굴, 콘텐츠 기획 제작 관련 업무 경험이 있으신 분 실용적인 글쓰기 역량을 바탕으로 다양한 콘텐츠 제작에 열려 있는 분 기업 간 거래B2B의 특성을 이해하여 잠재 고객사의 다양한 이해관계자를 설득할 수 있는 카피라이팅이 가능하신 분 B2B 비즈니스에서의 콘텐츠 마케팅 또는 브랜드 마케팅 경험이 있으신 분 검색엔진최적화SEO에 대한 기본적인 이해도가 있으신 분 B2B 고객 관리를 위한 CRM 툴 활용 경험이 있으신 분 
 디지털 콘텐츠웹드라마웹예능브랜디드 콘텐츠 기획 및 제안 실행 리딩 소셜 채널SNS 채널 마케팅 전략 수립 및 콘텐츠 기획운영제안 기획서 및 제안서 작성전략기획컨셉도출운영방안 콘텐츠 운영에 필요한 비즈니스 협업 조율진행 클라이언트 커뮤니케이션 등 AE 업무 전반, 포트폴리오 필수 제출회사 또는 개별 프로젝트가 담긴 포트폴리오 프로젝트 별 참여역할 및 참여도 기재 프로젝트 관리와 커뮤니케이션 스킬이 뛰어나신 분 논리적이고 유연한 사고로 취지에 맞는 콘텐츠 전략제안 수립이 가능하신 분 광고주 영업 및 디지털 캠페인 기획과 집행 경험 비딩 제안서 작성 경험자 최신 미디어 트렌드에 밝은 분 IMC 마케팅 및 디지털 캠페인 운영관리 경험 SNS 채널 기획운영 경험 대형광고주 경험 유사 미디어 업계 종사 경험
는 아래와 같습니다 인플루언서 유튜버 등 섭외 업무 SNS 콘텐츠 기획 및 광고 운영 크리에이티브 방향성 및 세부사항 협업 퍼포먼스 마케팅 운영 커뮤니티 마케팅, SNS를 활발하게 이용하고 활용이 가능한 분 다양한 분야 사람들과의 커뮤니케이션에 능숙하신 분 스스로 문제를 정의하고 해결책을 찾는 능동적 자세를 가진 분 숫자를 분석하고 해석하는 것에 능한 분 논리적인 사고를 하고 그것을 이야기할 수 있는 분 결과물에 책임감이 강한 분 유연한 사고를 가지신 분 IMC 마케터 성장을 희망하는 분
 인플루언서 유튜버 등 섭외 업무 SNS 콘텐츠 기획 및 광고 운영 크리에이티브 방향성 및 세부사항 협업 커뮤니티 마케팅 퍼포먼스 데이터 정리, SNS를 활발하게 이용하고 활용이 가능한 분 다양한 분야 사람들과의 커뮤니케이션에 능숙하신 분 스스로 문제를 정의하고 해결책을 찾는 능동적 자세를 가진 분 결과물에 책임감이 강한 분 유연한 사고 콘텐츠 마케팅에 관심이 많은 분 IMC 마케터로 성장을 희망하는 분
 Event Consultation  광범위한 디지털 이벤트 및 마이크로소프트 이벤트 플랫폼을 지원 이 플랫폼에서 마케터를 교육하고 모의 실행 및 기술 점검등을 통해 이벤트를 준비 디지털 이벤트 제공 및 고객 환경을 개선할 수 있는 새로운 방법을 모색 PreEvent  이벤트 진행자와 컨텐츠 자산 및 리뷰를 비교 확인하여 이벤트 실행을 계획 함 디지털 비디오 제작을 지원하고 이벤트와 관련된 모든 logistics가 성공적으로 진행 될수 있도록 지원함 Event Execution  이벤트 진행자와 협력하여 적절한 플랫폼을 통해 백그라운드에서 이벤트를 실행 PostEvent  Event가 마무리 된 후 관련 하여 follow up email이 잘 전달되는 지 확인 이벤트의이슈들에 대한 보고를 함 이벤트를 분석하고 이벤트의 효과를 측정하기 위한 이벤트 인사이트를 준비, 학력 대졸이상 경력 유관업무 경력 3년 이상 프로페셔널한 커뮤니케이션 능력 both written  verbal 뛰어난 한글영어 구사능력 기본적인 비즈니스 시스템 및 프로세스 분석 Virtual Event Marketing 및 이러한 이벤트와 관련된 도구와 기술에 대한 이해  유관 부서와 함께 서비스를 설명하고 진행하는 능력 Microsoft 브랜드 및 제품에 대한 지식 제출서류  국문  영문 이력서 자기소개서경력기술서 제출 영어 fluent한 분 꼼꼼 하신 분 Openminded
 Event Consultation  서비스팀의 전문가로서 이벤트가 기업 가이드라인을 따르도록 보장하고 기업 보고서를 활용 하여 이벤트에 대한 통찰력과 데이터를 제공함 이벤트의 재무 관리에 대한 기본 지원 분석 팀과 함께 참여하여 내부 이벤트 메트릭스 및 KPI를 구축  PreEvent  현장 이벤트의 프로젝트 관리자 역할을 수행하고 파트너 기관 및 참가자들과 협력하여 이벤트가 적시에 실행 될 수 있도록 함 계획된 프로세스별로 이벤트 진행사항을 확인하고 이벤트와 관련된 고객 이동 경로를 생성할 수 있도록 지원 Event Execution  Event Lead의 요청에 따라 적극적으로 현장 이벤트에 참석 하여 케이터링 AVrequirements 등 여러 로지스틱들을 Coordinate 함 PostEvent  Event가 마무리 된 후 관련 하여 내용과 데이터가 정확하게 보고 될 수 있도록 함 데이터를 분석하고 이벤트의 효과를 측정 하기 위한 이벤트 인사이트를 준비, 학력 대졸이상 경력 유관업무 경력 2년 이상 5년 이상 프로페셔널한 커뮤니케이션 능력 both written  verbal 뛰어난 한글영어 구사능력 Project Management Skill  기본적인 비즈니스 시스템 및 프로세스 분석 Event Marketing에 대한 이해  유관부서와 유연한 협의 협업 및 신속한 사고 고객 응대와 고객 서비스에 대한 열정 Microsoft 브랜드 및 제품에 대한 지식 Event  Project Management 관련 경험 국문  영문 이력서 자기소개서경력기술서 제출 영어 fluent한 분 꼼꼼 하신 분 Openminded
 Planning  Set up  캠페인 및 프로젝트 계획 관련 시스템을 통한 프로세스 확인 및 기대 목표 설정 등  Execution  Project Management  프로젝트의 처음부터 끝까지 진행 프로세스 관리 컨텐츠가 게시되는 상용 소셜 채널을 관리하고 현지화가 잘 되었는지 검토 Data  Insights   잠재 고객이 Marketo에 업로드 될 수 있도록 하고 마케팅 서비스팀이 제공하는 보고서를 사용 하여 이해 관계자에게 특정 정보를 제공 정기적으로 마케팅 서비스 대시보드를 검토 매월 분석 및 검토를 통해 마케팅 흐름과 메타데이터가 올바른지 확인 Subject Matter Expertise  관계자들에게 최신의 마케팅 서비스 및 마케팅 도구에 대해 교육, 학력 대졸이상 경력 유관업무 경력 2년 이상 7년 이상 프로페셔널한 커뮤니케이션 능력 both written  verbal 뛰어난 한글영어 구사능력 비즈니스 시스템 및 프로세스 분석 온라인과 오프라인 모두에서 마케팅 커뮤니케이션 방법 도구 및 실행에 대한 이해 관계사와 함께 서비스를 설명하고 전달하는 능력 원만하고 유연한 협업능력 및 갈등 요소 해결  동료 및 관계사들과의 원활한 업무 진행 능력 영어 fluent한 분 Allocadia와 Marketo 실무경험 능동적이고 크리에이티브 솔루션을 찾는 분 Openminded 세부 디테일에 강한 분 결과 중심
다음의 업무를 통해 목표를 달성하고 성장해요 신규 리뷰어 유치  리뷰쉐어 플랫폼 안에 더 많은 리뷰어 분들이 가입하실 수 있도록 다양한 전략을 활용하여 SNS 숏폼에서 신규 회원분들을 섭외하는 역할을 해요 신규 리뷰어 온보딩교육새롭게 가입한 리뷰어분들이 리뷰쉐어가 어떤 서비스인지 파악하고 잘 활동할 수 있도록 웰컴 메일 이용 가이드 제작 등 다양한 방법들을 고민하고 만들어나가요 리뷰어 플랫폼 활동 지원플랫폼을 실시간으로 모니터링 하며 리뷰어 분들이 더 많은 제안과 거래를 받을 수 있도록 서포트하는 역할을 해요 포트폴리오서비스 중 보완하면 좋을 부분들을 제안드리고 SNS를 검토하여 더 다양한 재능을 등록하여 수익을 창출할 수 있도록 도와드려요 리뷰어 카테고리 분류 및 관리  10만명이 넘는 회원들의 SNS 포트폴리오 등을 꼼꼼히 관찰하고 각 카테고리뷰티 패션 등을 분류해요 또한 분류 과정에서 발견된 불성실한 유저를 대상으로 경고블랙리스트 지정 등을 조치하여 비즈니스 회원이 겪을 수 있는 피해와 불편함을 최소화해요 세일즈팀 서포트  카테고리가 분류된 리뷰어 또는 신규 가입 리뷰어 등의 유의미한 정보를 세일즈팀에 공유하여 다양한 영업 기회를 창출해요,이런 분과 함께하고 싶어요 웹 플랫폼 서비스에 대한 높은 이해를 기반으로 유저사용자 관리에 대한 경험이 있는 분을 찾고 있어요 목표 설정 및 관리 이에 따른 운영 전략 성과 분석까지 직접 주도한 경험이 있는 분을 찾고 있어요 타인과의 소통을 즐겨하고 새로운 사람과의 만남을 두려워하지 않는 분을 찾고 있어요 본인의 의견을 논리적으로 표현하고 동료의 피드백을 겸허히 수용할 수 있는 분을 찾고 있어요 Google Workspace Notion Slack 툴을 사용할 수 있는 분을 찾고 있어요 우대사항이런 분이라면 더욱 환영해요 리뷰쉐어 서비스를 이해하고 사업의 성장성을 공감하시는 분이라면 더 좋아요 스타트업 플랫폼에서 근무했던 경험이 있는 분이라면 더 좋아요
 네이버 쇼핑11번가지그재그G마켓 영업 AE  상품 입점제안 및 운영영업  광고주 커뮤니케이션 및 광고운영관리,  학력  초대졸이상  경력  신입경력1년 영업직 경험자 아웃바운드 원활한 커뮤니케이션 가능자 검색광고마케터 자격증 보유자 동종 업계경력 1년 이상 우대연봉협의가능
 그로스 마케팅 전반의 업무 마케팅 외주 협력사 핸들링 고객 퍼널별 마케팅 플랜 수립 구체적 목표 수립과 지표  달성을 위한 전략실행계획 수립 각종 온라인 광고 매체별 실험 전략과 관리 CRM기획 및 관리 그 외 전사적 마케팅 전략 수립 컨텐츠 아이디어 협력 멀티미디어 기획마케터와 협력, 학력  고등학교 졸업 이상 경력  2년 이상 데이터 기반 분석계획 수립개선이 가능한 가능한 데이 터 문해력 분석 Tool 활용 역량 다양한 실험을 통해 효율유입을 개선한 경험이 있으신 분 다양한 영역의 카피라이팅에 능하신 분 능동적인 업무 수행 및 다양한 직군의 사람들과의 원활한 의사소통 능력 분야 경계 없이 올라운더 마케터로 성장하고 싶은 욕심이 있으신 분 데이터를 기반으로 서비스를 성장시켜 본 경험이 있으신 분 카피라이터 경험이 있으신 분 마케팅 기회를 스스로 발굴하는 자기주도성을 갖추신 분 영어 가능자 읽기 쓰기
 퍼포먼스 광고 매체 운영 구글 페이스북 네이버 등 국내외 광고매체  캠페인 운영 광고에 필요한 소개 기획 및 제작 운영 참여 자사몰 진행 프로모션 기획 및 운영 신규 매체 발굴 및 AB 테스트를 통한 성과 도출 대행사 및 관련 업체 소통, 관련 경력 3년 이상 구글 페이스북 등 국내외 매체 운영 경험이 있으신 분 논리적인 사고를 토대로 가설을 세우고 이에 맞는 실행과 결과 도출 과정을 경험해 보신분 이에 맞는 성향을 갖고 계신 분 각 매체별 특성을 파악하고 계신 분 프로모션을 기획 및 운영해 본 경험이 있으신 분 디지털 마케팅 생태에 대한 이해가 충분하신 분 브랜드 기획 및 운영 해보신 분 인하우스 마케터로서 경력 있으신 분 포트폴리오 첨부 필수 반려동물에 대한 이해도가 높으신 분 퍼포먼스 대행사 혹은 인하우스에서 브랜드 전반적인 퍼포먼스 마케팅 경험이 있으신분 각종 컨텐츠 제작 경험이 풍부하신 분 리빙 패션 트렌드에 관심이 많으신 분 커머스에 대한 이해도가 높으신 분 수동적인 마인드가 아닌 능동적이며 자발적으로 문제에 대한 해결 방안을 찾아내는 분
 광고주 캠페인 최적화를 위한 다양한 방법 제안 매체 제안 소재 제안 등 클라이언트 광고 제안시장조사 제안서 작성등 미디어 렙사 디자이너 개발자 등의 비즈니스 파트너들과의 협업을 위한 커뮤니케이션 매체 운영SA DA FB YouTube DSP 등 디지털 전 매체 결과에 따른 디지털 마케팅 퍼포먼스 분석 디지털 미디어믹스 전략 기획 및 제안 리서치애드 앱애니 등을 활용한 디지털 마케팅 시장 자료조사 주간 월간 광고 성과 리포트 작성 및 광고주 커뮤니케이션, 광고 에이전시 미디어렙 등 디지털 마케팅 경력이 1년 이상이신 분 논리적인 커뮤니케이션으로 구성원들과 협업이 가능하신 분 주도적이며 능동적으로 사고하고 계획실행분석을 완벽하게 하고 싶으신 분 앱웹 마케팅 데이터 기반 마케팅 등 전반적인 디지털 마케팅 방법론을 발전시키고 싶으신분 데이터  Tech 기반으로 폭발적으로 성장하는 디지털 마케팅 시장의 주인공이 되고 싶으신 분 트래킹 툴 사용 경험이 있으신 분 GA 애드브릭스 브랜치 앱스플라이어 등 Excel PowerPoint 사용 능력이 우수하신 분 데이터 기반 최적화 경험이 있으신 분 원활한 커뮤니케이션 능력이 있으신 분 통계 분석 능력이 우수하신 분 최신 디지털 마케팅 트렌드와 신규 매체에 대해 관심과 호기심을 가지고 탐구하고자 하시는 분
 SADAECSNS 마케팅 기획운영 채널별 프로모션마케팅 전략 수립 등 기획운영 데이터광고효과 분석 및 관리 광고 제안서기획서 작성, 초대졸이상 퍼포먼스 마케팅 경력자 OA활용 가능자엑셀 PPT 등 뷰티 등 관련 업무 경험자 외국어 가능자일어 영어 등 분석관련 툴 활용 가능자 마케팅 분야에 관심이 많은자
온라인광고대행 쇼핑몰컨설팅 키워드광고 DA광고 SNS광고 바이럴광고 모바일광고,  학력  학력무관  경력  경력자우대  분석력이 좋으신분 집중력이 좋은 사람 환영  마케팅에 대한 관심이 많고 분석하는 업무를 좋아하는 직원이라면 OK
 클라이언트 광고 운영 PM 클라이언트 광고 제안 PM확장제안 비딩참여등 캠페인 TF 조직 운영 KPI 달성을 위한 가설 설정 및 검증 데이터 기반의 의사결정 및 Insight 발굴 미디어 렙사 디자이너 개발자 등의 비즈니스 파트너들과의 협업을 위한 커뮤니케이션 매체 운영SA DA FB YouTube DSP 등 디지털 전 매체 결과에 따른 디지털 마케팅 퍼포먼스 분석 디지털 미디어믹스 전략 기획 및 제안 리서치애드 앱애니 등을 활용한 디지털 마케팅 시장 자료조사, 광고 에이전시 미디어렙 인하우스 마케팅 등 디지털 마케팅 경력이 3년 이상이신 분 클라이언트 or 캠페인 전반 PM 경험이 있으신 분 TF 팀 or 조직관리 경험이 있으신 분 주도적이며 능동적으로 사고하고 계획실행분석을 완벽하게 하고 싶은 분 앱웹 마케팅 데이터 기반 마케팅 등 전반적인 디지털 마케팅 방법론을 발전시키고 싶으신 분 데이터Tech 기반으로 폭발적으로 성장하는 디지털 마케팅 시장의 주인공이 되고 싶으신 분 트래킹 툴 사용 경험이 있으신 분 GA 애드브릭스 브랜치 앱스플라이어 등 Excel Powerpoint 사용 능력이 우수하신 분 데이터 기반 최적화 경험이 있으신 분 원활한 커뮤니케이션 능력이 있으신 분 분기 연간 단위의 데이터 통계 분석을 통해 새로운 Insight를 발굴하실 수 있는 분 제안서 작성 비딩 발표 등 RFP 대응 경험이 있으신 분
온라인 광고 대행SNS 광고 운영  컨텐츠 제작,학력  학력무관경력  컨텐츠 제작 또는 광고 관리 경력 1년 이상포트폴리오 필수포토샵 능숙자 센스있는 감각 소유자영상 제작 가능 및 활용 가능쇼핑을 좋아하고 쇼핑을 많이하는 직원이라면 OK포토샵 능숙자 센스있는 감각 소유자영상 제작 가능 및 활용 가능쇼핑을 좋아하고 쇼핑을 많이하는 직원이라면 OK
온라인광고대행 쇼핑몰컨설팅 키워드광고 DA광고 SNS광고 바이럴광고 모바일광고,  학력  학력무관  경력  경력자우대  분석력이 좋으신분 집중력이 좋은 사람 환영  마케팅에 대한 관심이 많고 분석하는 업무를 좋아하는 직원이라면 OK
 광고 운영 및 관리 전략 수립 이커머스 채널 운영, 3년 이상의 디지털 마케터 경험이 있으신 분 검색광고 대행사 경험이 있으신 분 비딩 제안 참여 이력이 있으신 분
 브랜드에 적합한 해외 인플루언서 섭외 및 관리 영어권  글로벌 국가 인플루언서 릴레이션십을 통한 협업 체계 구축 제품 홍보를 위한 매체 별 시딩 및 모니터링 일본 공식 SNSIG Tiktok TW FB Youtube콘텐츠 업로드 및 관리 인플루언서 마케팅에 필요한 제품 브리핑 자료 작성영문 해외 뷰티 시장 트렌드 분석, 경력무관 신입 지원가능 비즈니스 영어 가능자 한국어 의사소통 가능한 원어민 가능 원활한 커뮤니케이션 능력 보유하신 분 영문으로 인플루언서와 서면 ex 메신저 이메일 등 소통 가능하신 분 원어민 우대 뷰티 트렌드에 대한 관심과 이해도가 높으신 분 인플루언서 마케팅에 이해도가 있으신 분
 브랜드에 적합한 일본 인플루언서 섭외 및 관리 인플루언서 릴레이션십을 통한 협업 체계 구축 제품 홍보를 위한 매체 별 시딩 및 모니터링 일본 공식 SNSIG Tiktok TW FB Youtube콘텐츠 업로드 및 관리 인플루언서 마케팅에 필요한 제품 브리핑 자료 작성일문 일본 뷰티 시장 트렌드 분석, 경력무관 신입 지원가능 JLPT N2급 이상 혹은 JPT 700점 이상 보유하신 분 한국어 의사소통 가능한 원어민 가능 원활한 커뮤니케이션 능력 보유하신 분 일문으로 인플루언서와 서면 ex 메신저 이메일 등 소통 가능하신 분 원어민 우대 뷰티 트렌드에 대한 관심과 이해도가 높으신 분 인플루언서 마케팅에 이해도가 있으신 분
