회사명,고용 형태,스킬,기업 소개,주요 업무,채용 절차,복리후생,회사위치,자격요건 및 우대사항,index
(주)멘티스코,정규직,"['C#', 'C++', '프로그래밍', '게임기획', '데이터베이스']","멘티스코는 코스닥 상장기업인 캐리소프트의 ""캐리와 슈퍼콜라"" IP를 활용하여 ""캐리파크""를 개발 중입니다. 
""캐리파크""는 스토리&소셜 기반 메타버스 블록체인 게임으로, 2022년 4분기에 모바일 및 PC로 출시될 예정입니다.

멘티스코는 회사와 구성원이 함께 성장할 수 있는 사내 문화를 추구합니다.
“개발자가 즐겁게 게임 개발에 임할 수 있는 환경""을 중시하는 멘티스코는, 2022년 본사만의 DNA가 분명한 Global Game Company로 자리매김 할 것입니다.", 리눅스 기반의 모바일PC 게임 서버 개발,,"• 근무지 : 서울시 강남구 대치동 (2호선 선릉역)
• 근무시간 : 주5일 근무 / 10:00 ~ 19:00 / 시차 출퇴근제 지원
• 4대보험 및 퇴직금

• 연차휴가, 모성보호휴가
• 경조사 지원 : 경조휴가, 경조금, 화환
• 명절 선물 지급



멘티스코는 회사와 구성원이 함께 성장할 수 있는 방향으로 사내 문화와 복지 등을 정비하고 있습니다.
채용 페이지에 방문하시면 더 많은 정보를 확인하실 수 있습니다.","서울 강남구 삼성로85길 35-6, 4층", C 및 C언어를 사용한 프로그래밍 가능한 분 데이터베이스 프로그래밍이 가능한 분 멀티스레드 소켓 프로그래밍에 대한 이 모바일PC 개발 및 라이브 서비스 경험이 있는 분 블록체인 NFT 경험이 있는 분 언리얼4 게임 개발 경험이 있는 분,581
(주)마이베네핏,정규직,"['C#', 'C++', '유니티']",, 신규 프로젝트 개발 UI part  2D Ui toolkit 개발 기존 프로젝트 유지보수,,"• 출.퇴근 시간 탄력근무 가능
• 07~10시 자율 출근 (8시간 근무)
• 중식제공
• 매주 금요일 재택근무 시행","대전광역시 서구 한반대로570번길 26, 6층 526호", Unity UI 개발 가능하신 분 2D UI  UI toolkit C script 개발 가능하신 분 Git 등 형상관리툴에 익숙하신 분 네트워크 관련 개발 경험이 있으신 분 모션 인식 기반 지식이 있는 분 Kinet Unity Photon 개발 경험이 있으신 분 웹 서비스 관련 이해도가 있으신 분 Source control  issue tracking  bug tracking 경험이 있으신 분,582
(주)코그,정규직,"['기획', 'C#', 'C++', '프로그래밍', '클라이언트 프로그래밍 C++', '게임개발', '게임기획', '클라이언트', '클라이언트 개발', '유니티 언리얼 클라이언트']","KOG는 엘소드, 그랜드체이스, 파이터스클럽, 히어로, 아이마, 얼티밋레이스, 커츠펠등 다수의 게임을 개발하고 전세계에 서비스하고 있습니다. 2022년에는 커츠펠을 한국에 오픈했고, 신작 프로젝트 리턴 얼라이브 CBT를 진행했습니다.

현재 한국의 대구와 서울, 미국의 LA, 필리핀의 마닐라에 거점을 두고 약300명의 직원이 일하고 있으며, 특히 그랜드체이스와 엘소드는 브라질, 대만, 필리핀 등에서 1위를 차지한 성공적인 경험을 가지고 있습니다.

KOG의 가장 큰 특징은, 매 게임마다 항상 창의성을 가지고 새로운 것 들을 추구해 온 것입니다.
""그랜드체이스""는 온라인 대전이라는 새로운 장르를 개척하여 많은 후속게임들에게 영향을 끼치고 있습니다. 또한 ""와일드 랠리""를 통해서, 온라인 레이싱 분야를 개척하였습니다. 현재도 이러한 KOG만의 특징이자 장점인 새로운 것을 추구하기 위해 개발과 게임에 대한 연구에 많은 투자를 하고 있습니다.

KOG는 함께 성장해 나가기 위해 국내와 해외로 가는 워크샵을 진행하고 각 파트 별로 정기적인 스터디 모임을 지원하고, 외부 유명강사를 초청하여 강연을 하며 이러한 프로그램들을 통해 직원들의 발전을 중요하게 생각하고 노력 하고 있습니다.",게임 클라이언트서버기획 아트 등 다양한 직군들과 협업을 통해 새로운 게임 기능을 만드는 역할게임에 필요한 구조 설계 및 개발 효율적인 업무를 위한 툴 개발 등게임기획게임 분석을 통한 이슈 제시 및 개선안 기획게임 컨텐츠 개발 컨텐츠 디자인 시스템 설계 등,홈페이지 서류 지원 > 면접 > 최종합격,"오피스텔: 대구 본사 근무시 오피스텔 제공
사내식당: 아침, 점심, 저녁 무료 제공
게임/콘텐츠 지원비: 매년 120만원 상당의 문화생활지원비 제공
카페테리아: 커피와 음료, 과일 등 무료 이용 가능
리프레시 휴가: 3년 단위 리프레시 휴가, 휴가비 지급
근속휴가: 5년 단위 순금 명함 지급
종합건강검진: 매년 종합 건강검진 지원
피트니스 지원: GX, 헬스, 사우나 등 무료 이용 가능
경조사: 각종 경조금 및 선물, 물품 등 지원
임신 및 육아지원: 출산휴가, 육아휴직, 첫돌 축하선물 제공
그외 사내 동호회, 사내/외교육, 사내게임룸, 생일 및 명절 선물, 심리상담, 사내추천제도 등","대구 중구 국채보상로 586, 14층 (동성로2가,교보생명빌딩)",클라이언트서버좋은 디자인과 아키텍처를 추구하며 주어진 문제를 해결하기 위해 다양한 기술을 탐색하고 연구하는 적극적인 자세를 가지신 분기술적 정보를 다양한 직군의 동료에게 명확하게 설명할 수 있는 커뮤니케이션 능력을 가지신 분게임기획자신의 아이디어를 정확히 전달할 수 있는 문서 작성 이미지화 능력이 있으신 분주어진 문제를 해결하기 위해 다양한 기술을 탐색하고 연구하는 적극적인 자세를 가지신 분이공계열 정보처리 분야 석사학위 취득자 또는 석사졸업예정자,583
오케스트로(주),정규직,"['재무기획', '재무제표 작성', '실적분석', '회계결산', '경영계획수립', '외부감사대응', '투자관리', '자금계획수립', '자금수지']","
[오케스트로는 계속 변화합니다]
오케스트로는 스스로의 한계를 제한하지 않습니다
클라우드 산업의 새로운 기준을 만들어가는 오케스트로에서
함께 성장할 소중한 동료를 기다립니다
더 큰 성장을 통해 세상을 변화 시키시고 싶은 분이라면 지금 바로 합류하세요",Finance 팀은회계 세무 자금이라는 큰 틀에서 회사에서 일어나는 모든 일을 숫자로 관리하고 관리된 숫자를 기준으로 필요한 데이터를 내부외부 커뮤니케이션을 합니다 재무 기획업무         분기반기기말 결산 자료분석 및 보고         추정 재무제표 작성 및 자금수지 계획 수립         경영 계획 수립 및 실적 검토         외부 감사 투자 업무 지원,,"• 자율 출퇴근
매일 매일 편한 시간에 출근하세요(9시 ~ 10시)
하루 8시간 열심히 근무하신다면 언제든지 퇴근 하셔도 괜찮아요
• 식비 지원
오케스트로는 점심, 저녁 식대를 제공해드려요
매일 매일 맛있는 식사로 힐링해 보세요
• 각종 휴가 지원
눈치 보지 말고 자유롭게 신청하세요 (연차, 반차, 반반차 운영)
여름휴가(연차 외 최대 3일), 기념일 휴가(본인, 자녀 입학/졸업식 유급)를 제공해드려요
• 개인 장비 지급 (Mac Pro, 모니터 등)
빛나는 성과를 내는데 꼭 필요한 최고급 사양의 업무용 장비를 지원해드려요
필요한 장비, 필요한 소프트웨어는 언제든지 지원해드리니 부담 없이 요청해주세요
• 도서 구입비 지원
개인의 성장이 조직의 성장을 이끈다고 믿어요
새로이 발전하는 기술 트렌드를 익히고 발전시킬 수 있도록 교육비, 도서 구입비를 지원해드려요
• 결혼 장려금 / 출산 장려금 지원
개인의 생활과 직장이 조화를 이루도록 지원해드려요
일생에 가장 축하할 일인 결혼과 출산 장려금을 드려요
• 자유로운 복장
개인의 개성과 스타일을 존중해요
편하게 입으시고, 눈치 보지 마세요
• 그 외
종합 건강검진, 생일 축하(선물 & 조기 퇴근), 명절 선물 등","서울 영등포구 여의대로 108, 43층", 7년 이상 관련 업무 경험하신 분         더존 스마트AWEHAGO 사용이 능숙하신 분         책임감 있고 적극적인 성격을 보유하신 분         MSOffice엑셀 파워포인트 활용이 가능하신 분 스타트업이나 IT산업의 조직문화를 경험해 보신 분 IPO 업무를 수행해보신 분 회계 관련 자격증 보유하신 분,584
