주요 업무,자격요건 및 우대사항
 UXP에서 담당하는 뱅크샐러드의 네이티브 기능 개발을 진행합니다 뱅크샐러드의 주요 제품인 홈 가계부 종알림 화면을 개선하고 새로운 기능을 추가합니다 Push Notification 딥링크 관련 기능을 개선하여 유저가 기능을 빠르고 쉽게 접근할 수 있도록 합니다 개발 생산성 작업을 담당합니다 Web과 Native 간의 interface를 유지보수하여 WebView 기반의 서비스를 안정적으로 운영할 수 있도록 합니다 프로젝트 내 같은 관심사를 갖는 코드의 모듈화 작업을 진행합니다 iOS Chapter 내 코드리뷰에 참여하여 코드 퀄리티 향상에 기여하고 기술 토론을 통해 Best Practice 를 논의하여 개발 생산성을 향상시킵니다 뱅크샐러드 iOS 엔지니어 iOS Engineer는 아래의 , iOS 개발경험이 4년 이상이거나 그에 준하는 실력을 보유하고 있으셔야 합니다 Swift 언어에 대한 높은 이해도를 기반으로 제품을 출시한 경험이 있으셔야 합니다 반응형 프로그래밍 eg RxSwift Combine의 경험이 필요합니다 앱 아키텍처에 대해 고민하고 적용했던 경험이 있으셔야 합니다      MVVM MVP 등의 디자인패턴을 적용해본 경험      공통적으로 쓰이는 코드를 모듈화한 경험 등 Apple Human Interface Guidelines에 대한 이해가 필요합니다 UnitTest 작성 경험이 있으셔야 합니다 다양한 CrashReporting Analytics 도구들을 이용하여 문제를 분석하고 해결할 수 있어야 합니다 Xcode에서 제공하는 View hierarchy Memory graph Debug navigator 등을 이용한 이슈 해결 경험이 있으셔야 합니다 프로젝트에서 필요한 외부 라이브러리를 적절한 요구조건에 맞게 선택하고 검증 및 적용할 수 있어야 합니다 AB 테스팅을 위한 도구사용 및 코드분기 경험이 필요합니다 접근성에 대한 이해가 있는 분을 우대합니다 CICD 설계 및 유지보수 경험이 있는 분을 우대합니다 모듈화 등을 통해 전반적인 프로젝트 관리 및 유지보수성을 높인 경험이 있으면 더욱 좋습니다 10명 이상의 엔지니어와 함께 6개월 이상의 프로젝트에 깊게 참여했던 경험을 우대합니다 Instrument 등을 사용하여 디버깅 난이도가 높은 이슈를 해결한 경험이 있으면 더욱 좋습니다 새로운 기술이나 개발 패러다임에 관심있고 꾸준히 학습하는 분이면 더욱 좋습니다 오픈소스 프로젝트에 기여한 경험을 우대합니다 내 작업물을 문서나 외부 공유용 Readme 블로그 등 으로 기록하고 업데이트 하는 습관을 가지신 분이면 더욱 좋습니다
 드로니아 서비스 웹 프론트 개발반응형, 3년 이상의 직무 관련 경험을 보유하신 분 서비스 배포 경험이 있으신 분 관련 학과를 전공하신 분 프론트엔드부터 백엔드까지 웹앱 서비스 전반에 대한 이해가 깊은 분 초기 스타트업에서 팀원 리딩을 해 본 경험이 있는 분 다양한 부서와의 커뮤니케이션 경험을 보유하신 분 진취적인 사고방식과 책임감이 있으신 분 아래 기재된 언어 혹은 프레임 워크를 사용해본 경험이 있으신 분    Html css javascript react nextjs tailwind css material uic
 범위는 글로벌 고객을 대상으로 하는 ReactNative 앱 과 앱 내의 웹뷰를 구축하는 것이에요 프론트엔드 엔지니어로 일하며 Global Dev 팀의 기존 프론트백엔드 엔지니어 각 국 법인 매니저 및 디자이너와 함께 일하게 돼요 , 이런 휴먼이라면 시너지를 낼 수 있어요     React를 활용한 프론트엔드 개발 경력이 2년 이상이어야해요     Typescript를 활용한 개발 경력이 1년 이상이어야해요     마미톡 글로벌답게 영어로 된 개발 문서를 읽는데 어려움이 없으면 좋아요     어떤 디자인이든 CSS는 자신있다 라는 자신감이 있는 분을 찾아요     중간 단위 피쳐 개발을 외부 인원의 가이드 없이 끝낼 수 있는 분을 찾아요     잘 정리된 코드를 설계하고 작성할 수 있어야 해요 개선이 필요한 코드를 인식하고 자신이 수정한 코드가 이전보다 더 나은 상태가 되도록 만들 수 있는 분을 찾아요     담당하는 코드베이스 제품 영역 및또는 시스템에 대한 이해도가 높은 분을 찾아요 필요에 따라 변경 사항을 식별하고 적절히 대응까지 할 수 있으면 좋아요     비엔지니어링 인원 및 유관 파트너 팀과의 효과적인 협업을 통해 업무를 처리하는 방법을 알고 있어야 하며 릴리스 주기 제품 출시 및 SEV심각한 문제에 제품 및 개발이 어떻게 영향을 받는지 알고 있어야 해요네이티브 앱iOS 또는 Android 개발 경력도 있다면 더 좋지만 그렇지 않아도 괜찮아요
 Android 앱 개발 iOS 앱 개발 Web 개발 서버개발, Android  iOS 배포 경험 및 개발유지 보수 경력 있으신 분 Android  iOS 아키텍쳐 설계 및 소프트웨어 디자인 패턴에 대한 이해도가 있으신 분 Web 개발의 경우는 Vuejs React Anglar 또는 이에 준하는 프레임워크 관련 경력이 있으신 분 코드 리뷰와 지식 공유에 적극적이신 분 문제 해결 및 코드 품질 개선에 적극적이신 분 Kotlin  Swift 개발 언어에 능숙하신 분 축구 좋아하시는 분 호날두 좋아하시는 분 호날두 싫어하시는 분 Z  D 아시는 분
기업활동을 국제적 표준에 의해 인정받을 수 있는 탄소 배출량으로 측정하고 관리하는 탄소회계 플랫폼 개발을 리드탄소희계 엔진 REST API 개발탄소회계 SaaS 개발스킬 JAVA JSP,소프트웨어 개발 및 데이터에 대한 이해도가 높은 분Linux DB HTTP REST API 등에 대한 기본적인 이해가 있으신 분Git 등 분산 버전 관리SCM 시스템을 이용한 협업 경험이 있는 분1개 종류 이상의 데이터베이스 사용 경험을 가지고 계신 분웹 기술에 대한 이해가 있으신 분영어가 능통하신 분프로젝트 리드역량애자일 프로젝트 수행경험글로벌 프로젝트 수행역량실제 제품 개발 경험이 있으신 분IT 기술을 이용해 탄소중립 문제를 해결하는 데에기여하고 싶으신 분온실가스 배출량 산정에 대한 지식이 있는 분환경 관련 학위나 환경 관련 자격증을 소지한 분
 개발팀 시니어 SW 개발자 글로벌 Toptier 반도체 기업 및 연구기관에 제공할 엔지니어링 솔루션 소프트웨어 개발, 컴퓨터 과학 또는 관련 공학 학사 또는 이와 동등한 경험 새로운 기술 습득 및 도입에 적극적인 태도 소프트웨어 개발 라이프 사이클에 대한 이해 뛰어난 구두 및 서면 커뮤니케이션 능력 적절한 데이터 구조 및 알고리즘을 사용한 문제 해결 기술 소프트웨어 제품 설계 및 아키텍처 테스트 경험 유지 관리 또는 출시 경험 객체 지향 소프트웨어 디자인에 대한 탁월한 이해 CC JAVA Python 또는 유사 프로그래밍 언어로 고품질 코드 개발 경험 CICD 파이프라인 유지 및 구축 경험 윈도우Linux 용 응용 SW 개발 경력 JavaFX를 이용한 소프트웨어 개발 경험 JavaScript 라이브러리 및 최신 프레임워크예 React Next 사용 경험 컴퓨터 과학 또는 관련 기술 분야의 석사 또는 박사 학위 대규모 인프라 분산 시스템 또는 네트워크 개발 경험 및또는 컴퓨팅 기술 스토리지 또는 하드웨어 아키텍처 경험 AWS GCP Kubernetes 를 이용한 클라우드 솔루션 구축 경험 머신러닝과 딥러닝에 대한 지식 반도체에 대한 지식
 개발팀 주니어 SW 개발자전문연구요원 글로벌 Toptier 반도체 기업 및 연구기관에 제공할 엔지니어링 솔루션 소프트웨어 개발, 컴퓨터 과학 또는 관련 공학기술 분야의 석사 이상 학위 취득자 새로운 기술 습득 및 도입에 적극적인 태도 소프트웨어 개발 라이프 사이클에 대한 이해 뛰어난 구두 및 서면 커뮤니케이션 능력 적절한 데이터 구조 및 알고리즘을 사용한 문제 해결 기술 CC JAVA Python 또는 유사한 프로그래밍 언어로 고품질 코드 개발 경험 객체 지향 소프트웨어 설계에 대한 이해 CICD 파이프라인 유지 및 구축 경험 AWS GCP Kubernetes 를 이용한 클라우드 솔루션 구축 경험 머신러닝과 딥러닝에 대한 지식 반도체에 대한 지식
 개발팀 주니어 SW 개발자 글로벌 Toptier 반도체 기업 및 연구기관에 제공할 엔지니어링 솔루션 소프트웨어 개발, 컴퓨터 과학 또는 관련 공학 학사 또는 이와 동등한 경험 새로운 기술 습득 및 도입에 적극적인 태도 소프트웨어 개발 라이프 사이클에 대한 이해 뛰어난 구두 및 서면 커뮤니케이션 능력 적절한 데이터 구조 및 알고리즘을 사용한 문제 해결 기술 CC JAVA Python 또는 유사한 프로그래밍 언어로 고품질 코드 개발 경험 컴퓨터 과학 또는 관련 기술 분야의 석사 또는 박사 학위 객체 지향 소프트웨어 설계에 대한 이해 CICD 파이프라인 유지 및 구축 경험 AWS GCP Kubernetes 를 이용한 클라우드 솔루션 구축 경험 머신러닝과 딥러닝에 대한 지식 반도체에 대한 지식
 AI 기반의 반도체 소자 Compact model과 회로 시뮬레이터를 연결하는 인터페이스 개발 Neural compact model을 보완하는 수치 해석 기법 개발 Neural compact model을 위한 Spice 시뮬레이터 개발, 반도체 전자공학 또는 관련 분야 석사 이상 HSPICE SPECTRE등을 활용한 회로 설계 업무 경험 BSIM model 관련 연구 경험 스스로 문제를 찾고 같이 해결하려는 마인드 새로운 기술 습득 및 도입에 적극적인 태도 소프트웨어 개발 라이프 사이클에 대한 이해 뛰어난 구두 및 서면 커뮤니케이션 능력 뛰어난 CC 파이썬 skill 반도체 전자공학 또는 관련 기술 분야의 박사 학위 Spice simulator의 common model interface에 대한 경험 리눅스 기반 library system 개발 경험 전문가용 SW 개발 경험 머신러닝과 딥러닝에 대한 지식
 AI 기반의 반도체 소자 Compact model과 회로 시뮬레이터를 연결하는 인터페이스 개발 Neural compact model을 보완하는 수치 해석 기법 개발 Neural compact model을 위한 Spice 시뮬레이터 개발, 반도체 전자공학 또는 관련 분야 학사 이상 HSPICE SPECTRE등을 활용한 회로 설계 업무 경험 새로운 기술 습득 및 도입에 적극적인 태도 뛰어난 구두 및 서면 커뮤니케이션 능력 CC 파이썬 skill 반도체 전자공학 또는 관련 기술 분야의 석사 학위 머신러닝과 딥러닝에 대한 지식 Spice simulator의 common model interface에 대한 경험 BSIM model 관련 연구 경험 리눅스 기반 library system 개발 경험 전문가용 SW 개발 경험
Embedded Multimedia 솔루션 개발Embedded Application Framework 개발,학력전공  학사이상이공계열경력  3년이상  20년 이하C언어 숙련자Embedded Linux 개발 경험영상 처리 개발 경험Multimedia Framework 유경험자 Gstreamer ffmpeg 등Multimedia Device 제어 유경험자 V4L2 Codec 등오픈소스 활용 유경험자Linux 숙련자Allwinner Rockchip Hisilicon SigmaStar AP 유경험자
BlackBox 단말 Application개발BlackBox 단말 GUI 개발Micom Firmware 개발,학력  전공  학사 이상무관경력  3년이상  10년이하Embbed Linux 개발 환경에서 개발 가능자CC 언어 사용 가능자Embbed Linux 장치 개발 경험자BlackBox 개발 경험자단말 GUI 개발 경험자
선행 기술 검증 및 SW 개발 업무전장 소프트웨어 개발 PM 업무,학력전공  학사 이상공학계열경력  경력 5년 이상전장 SW 개발 및 시스템 PM 경력자CC 사용 능통자Embedded linux 익숙한 자전장용 센서 관련 FW 개발 경험자ADAS 관련 업계 종사자 혹은 경험자신기술 Trend에 대한 기술 기획 마인드 보유외주 개발사사업자 등과의 원활한 소통 역량 보유
Computer vision기반 인식 알고리즘 구현 및 영상 처리OpenCV 혹은 OpenGL 을 활용한 알고리즘 구현 및 영상 처리Camera calibrationADAS 알고리즘 구현Application software 구현 및 상품화,학력전공  학사 이상공학계열경력  5년 이상  10년 이하머신딥러닝 개발 종사자 또는 Vision알고리즘 개발 종사자사용 Languge  C C PythonOpenCV OpenGL등 영상관련 library사용에 익숙한 자ADAS 관련 업계 종사자 혹은 경험자Embedded linux환경에 익숙한 자
Cloud Service App 개발 및 운영단말연동 WIFI App 개발 및 운영,단말연동 WIFI App 개발 및 운영  학력전공  학사 이상무관경력  2년 이상  10년 이하 상용 서비스 출시관리 경험Store 등록 및 관리 경험 있으신 분Kotlin JAVA 능숙하게 사용하실 수 있는 분서버클라이언트 간 RESTful 기반 연동 개발 경험PM PL 경험Multimedia 관련 App 개발 경험위치기반 서비스 App 개발 경험빠른 개발보다는 성능에 관심 있으신 분개발에서 소통과 협력이 가장 중요함을 알고 계신 분코드리뷰에 개방적이신 분새로운 기술을 시도하는 것에 대해 개방적이신 분
최신 기술 트렌드 파악 및 POC 확인프로젝트 관리 및 팀 관리딥러닝 기반 인식 네트워크 개발컴퓨터 비전 기반 ADAS 알고리즘 개발3D vision 알고리즘 개발,학력전공  석사 이상경력  석사 7년 이상  박사 5년 이상프로그래밍 언어  Python CC관련 전공 석박사 학위 수여자딥러닝 네트워크 임베디드 포팅 경험자컴퓨터비전 알고리즘 개발 경험자PyTorch Git Docker 사용 가능자
사용 기술 Python SW C  C Network java 산업용 장비 SW 통신 네트워크 구축 및 시스템 구축, 학력 대졸 이상 전공 컴퓨터공학과 소프트웨어과 등 경력자인 경우 프로젝트 진행이 가능한 개발언어JAVACCPython 능력 보유자 프론트엔드 및 백엔드 등 웹개발 경험 네트워크 구축 및 시스템 구축 신재생에너지 및 장비제어 관련 경력자 공공기관 프로젝트 경험
사용 기술Java C  SW  C Python 산업용 장비 SW 제어 및 모니터링 프로그램 개발, 학력 대졸 이상 전공 컴퓨터공학과 소프트웨어과 등 경력자인 경우 프로젝트 진행이 가능한 개발언어JAVACCPython 능력 보유자 프론트엔드 및 백엔드 등 웹개발 경험 네트워크 구축 및 시스템 구축 신재생에너지 및 장비제어 관련 경력자 공공기관 프로젝트 경험
사용기술Java C C Python 산업용 장비 데이터베이스 구축 및 서버관리데이터 운영, 학력 대졸 이상 전공 컴퓨터공학과 소프트웨어과 등 경력자인 경우 프로젝트 진행이 가능한 개발언어JAVACCPython 능력 보유자 프론트엔드 및 백엔드 등 웹개발 경험 네트워크 구축 및 시스템 구축 신재생에너지 및 장비제어 관련 경력자 공공기관 프로젝트 경험
 산업용 장비 SW관련 웹 백엔드 작업 및 API 개발, 학력 대졸 이상 전공 컴퓨터공학과 소프트웨어과 등 경력자인 경우 프로젝트 진행이 가능한 개발언어JAVACCPython 능력 보유자 프론트엔드 및 백엔드 등 웹개발 경험 네트워크 구축 및 시스템 구축 신재생에너지 및 장비제어 관련 경력자 공공기관 프로젝트 경험
 디지털 트윈 플랫폼 개발 C 자료구조 알고리즘 이해 및 네트워크 프로그래밍, 2년 이상 경력을 갖추신 분 C 자료구조 알고리즘 이해 및 네트워크 프로그래밍 경험이 있으신 분 프로그래밍 경험이 있으신 분스펙 Unity 3D C 웹 기반의 프로젝트이기에 WebGL 기반 유니티 3D개발 경험이 있으신 분 Digital Transformation의 새로운 영역에 대한 관심 및 도전 의식을 갖추신 분 긍정적인 업무 마인드를 갖추신 분 본인 역할에 대한 책임감이 강한 분
 글로벌 고객사 프로젝트 수행 Python SW 구조 설계 및 개발 업무 각종 Functional Test SW 개발사용 기술Python C Linux, 전기전자공학 정보통신공학 컴퓨터공학을 전공한 학사 이상 Python을 이용한 프로젝트 개발 경력자 우대35년 영어 가능자
버즈니 AI 기술을 활용한 서비스 개발 및 운영커머스 AI 백오피스 개발 및 운영,관련 업무 최소 4년 이상 있으신 분 필수React Typescript ES6 기반의 프로젝트 경험이 있으신 분REST API 를 활용한 Web 개발 경험이 있으신 분Javascript 및 HTML5 CSS3에 대한 지식 및 경험이 있으신 분기획  디자인 등 다양한 직군과의 원만한 커뮤니케이션 및 협업 능력을 갖추신 분AI도메인에 관심이 있으신 분Nextjs를 기반으로 한 프로젝트 경험이 있으신 분서비스를 직접 개발운영 해보신 분대규모 사용자 서비스 경험이 있으신 분BackEnd 시스템에 대한 이해도가 높으신 분테스트배포 환경 구축운영 경험이 있으신 분웹표준 및 웹접근성에 대한 이해가 높으신 분웹 성능 최적화 경험이 있으신 분
홈쇼핑모아 서비스 개발     React ReactNative Reactnavigation Nativewindcss로 홈쇼핑모아 서비스 앱 개발주 업무 상태 관리 도구 Context API React Query를 사용한 데이터 연동 및 기능 개발 서비스 개발시 성능 이슈를 고려한 앱 개발  생산성 증대를 위한 지속적인 구조 코드 개선 및 버그 이슈 관리 사자마켓 등 자사 서비스 관리 및 개발앱 및 웹 서비스,필수 FE 개발 업무 최소 3년 이상이신 분 ReactNative 최소 2년React ReactNative ES6 기반의 프로젝트 경험이 있으신 분REST API 를 활용한 애플리케이션 개발 경험이 있으신 분Git Github 버전관리 시스템 사용 경험 애플리케이션 성능 최적화 경험이 있으신 분기획  디자인 등 다양한 직군과의 원만한 커뮤니케이션 및 협업 능력을 갖추신 분Javascript 및 HTML5 CSS3에 대한 지식 및 경험이 있으신 분 웹표준 및 웹접근성에 대한 이해가 높으신 분 참고사항  해당 직군은 상세 경력기술서 제출이 필수입니다커머스 서비스를 직접 개발운영 해보신 분대규모 사용자 서비스 경험이 있으신 분개발지식 공유 활동 경험이 있으신 분개발 프로젝트 리딩 경험이 있으신 분BackEnd 시스템에 대한 이해도가 높으신 분테스트배포 환경 구축운영 경험이 있으신 분Expo Typescript 기반 프로젝트 경험이 있으신 분
인 월 결산 기능 고도화 및 모듈 관련 업무 문의 대응 및 시스템 개선  반복되는 비효율 업무 정기 개선 진행  대량의 데이터 인터페이스 방식 개선 및 프로그램 튜닝 작업 수행 다양한 SAP 시스템 프로젝트를 수행 가능  SAP ITO 수행을 통해 고객 개선 과제 및 SM 프로젝트 경험  SM 프로젝트  해외 법인 확장하는 프로젝트까지 개인 의사에 따라 진행 가능  프로젝트 수행을 통해 운영 업무에서 접할 수 없는 SAP의 다양한 기능을 경험할 수 있으며  SAP 전문가로 성장 가능성 높음, Experience  SAP MM SD PP 모듈 중 1개 모듈 운영 경력 3년이상  ABAP 개발 및 IMG 세팅   모듈 개별 채용 진행   Skill  Knowledge  고객과의 원활한 커뮤니케이션 ERP시스템 SCM 전문 지식 및 운영 경험  물류 프로세스 이해  SAP S4HANA 기반 프로젝트 경험 및 프로젝트 리딩 경험
 메시징 기반 모바일 앱 개발 Lysn 및 디어유 버블 서비스 기능개발 및 유지보수 리팩토링 및 아키텍처 개선, ObjectiveCSwift을 이용한 네이티브 앱 서비스 개발 경력자 Custom UI 및 다양한 디자인은 UIUX 개발 경험자 상용 서비스 개발 및 유지보수 경험자 RESTFUL API에 대한 기본적인 이해를 가지신 분 MVPMVVM 등 디자인 패턴에 대한 이해와 경험 AACAndroid Architecture Components를 통한 개발 경험자 Live StreamingHLS RTSP 등 Client 개발 경험자 오픈소스 분석 및 사용 경험자 메신저 앱 개발 경험자
 메시징 기반 안드로이드 모바일 앱 개발 Lysn 및 디어유버블 서비스 기능개발 및 유지보수 리팩토링 및 아키텍처 개선, KotlinJava를 이용한 Android 앱 서비스 개발 경험자 상용 서비스 개발 및 유지보수 경험자 RESTFUL API에 대한 기본적인 이해를 가지신 분 코드 품질 및 개선에 관심이 많으신 분 MVPMVVM 등 디자인 패턴에 대한 이해와 경험 AACAndroid Architecture Components를 통한 개발 경험자 Live StreamingHLS RTSP 등 Client 개발 경험자 오픈소스 분석 및 사용 경험자
합류하시면 이런 일을 함께 해요 SaaS 솔루션이 끊김없이 제공될 수 있도록 고가용성을 갖춘 서버를 비용 최적화하여 개발하고 운영해요 온디멘드 서비스 뿐 아니라 AWS Lambda와 같은 서버리스 서비스들도 적극 활용하고 있어요 PO 프론트엔드 엔지니어와 소통하며 요구사항 스펙에 맞춰 API를 개발해요 API 기획 명세서를 작성하고 관리해요 지속적으로 쉽고 빠르게 개발할 수 있도록 코드 모듈화 퀄리티 향상에 앞장서요,와들은 이런 분을 찾고 있어요 FastAPI Flask를 사용하여 REST API를 제공하는 백엔드 서버 개발 역량을 갖춘 분 AWS EC2 S3 RDS Lambda 서비스를 능숙하게 이용하실 수 있는 분 SaaS 프로덕트의 서버를 설계하거나 배포한 경험이 있다면 더욱 좋아요 와들은 다음의 개발 스택을 활용하고 있어요 Python 310 Fast API Flask PyTorch AWS EC2 ELB ASG API Gateway RDS Lambda이런 성향을 가진 분과 함께하고 싶어요 확장성 재사용성을 고민하며 개발하고 이러한 문화와 개발 환경 구축에 관심이 많으신 분 여러가지 상황을 깊게 고려하여 안정성 있는 개발을 추구하는 분 개발 과정에서 얻은 레슨런을 팀 내부에 전파하며 함께 성장하실 분 코드 리뷰 포스트 모템 작성 등 개발 조직의 문화에 관심이 있는 분
 IT 시스템 기획 및 운영ERP플랫폼WMS그룹웨어 IT 중장기 전략운영 기획로드맵 수립 투자비용관리 KPI 지원 IT 거버넌스 및 관리체계 수립 지원 ITO 계약비용SLA 관리 IT 프로젝트 PMO 내부회계 ITGC, 대학교 4년제 졸업생 이상 컴퓨터공학전산학산업공학경영학 전공자 경력 4년  6년 이하 IT 프로젝트 수행 경력자필수역량 회사부서간 원활한 조율과 협업을 위한 커뮤니케이션 및 문서 작성 역량 HW SW 솔루션 도입 등 관련 프로젝트 경험 전략적 논리적 사고 기반 IT 전략 수립 및 기획 능력 내부회계 ITGCIT General Control 업무 경험 데이터 활용 역량데이터 분석BI 활용 등 상장사급 기업의 IT 프로젝트 DX 경험 CRM 구축 경험MSSalesforce 등 ERP 개발 Tool 사용 경험더존영림원이맥스 등
 금융 VAN 서비스 및 펌뱅킹원화외화 시스템 고도화 및 연계 개발 및 운영 대외 연계 모듈 모니터링 등 개발 및 운영,필수기술 C 언어 DB 사용 경험이 있으신 분 리눅스 사용 경험이 있으신 분 효과적인 의사 전달 및 협업에 능하신 분 기존 시스템의 파악 및 개선에 적극적인 분 배움에 열정이 있고 오랫동안 함께하며 서로 힘이 되어 줄 분 VAN금융 서비스 운영 및 개발 경험이 있으신 분 C언어 기반의 ProC 개발 경험이 있으신 분 IPCInter Process Communication 통신 개발 경험이 있으신 분 Linux 개발 경험 shell script 사용 경험이 있으신 분 TCPIP 네트워크 프로그래밍 경험이 있으신 분 Architecture 개선 및 설계 경험이 있으신 분 Legacy 시스템 업무 전환 경험이 있으신 분 DB설계 경험 Oracle 사용 경험 OLTP 경험이 있으신 분 Multi_Process 경험 및 이해도가 있으신 분
 Python 퀀트 알고리즘 리팩토링 알고리즘 운용 자동화 백엔드 개발, Python 프로그래밍 언어 및 Pandas 라이브러리 활용 능력 원활한 커뮤니케이션 능력 파이썬 데이터 병렬처리 및 고속화 관련 지식 Numba Ray 등 FastAPI Django Flask 등 파이썬 웹 백엔드 프레임워크 경험 국내  해외 주식 재무데이터에 대한 이해
