주요 업무,자격요건 및 우대사항
 클라우드 모니터링 솔루션 개발   데이터 수집 pipeline 개발,  Java 11 버전 이상 개발 경험이 있으신 분   SpringBoot를 이용한 Web Application 개발 경험이 있으신 분   JPA MyBatis 사용 경험이 있으신 분   RDBMSMySQL PostgresSQL 경험이 있으신 분   ElasticSearch Logstash 사용 경험이 있으신 분   Big data 처리 경험이 있으신 분  데몬 배치 개발 경험이 있으신 분   AWS GCP 등 public cloud 환경 경험이 있으신 분   프로젝트 리딩 또는 관리 경험이 있으신 분   비즈니스 로직에 대한 이해를 바탕으로 API와 데이터 모델을 설계할 수 있으신 분   코드리뷰에 거부감이 없으신 분   자신이 경험한 프로젝트에 대해 구체적이고 명료한 설명을 할 수 있으신 분   주도적으로 문제를 찾고 해결할 수 있으신 분   모니터링 프로세스 및 솔루션 개발 경험이 있으신 분   협업툴 사용 경험Jira Git Confluence이 있으신 분 
 전사적으로 발생하는 다양한 문제들을 데이터를 기반으로 해결 방법을 찾고 결과를 동료에게 효과적으로 전달 맞춤형 건강관리 상품 추천 등 다양한 헬스케어 앱 서비스를 위한 알고리즘 개발 및 고도화   eg 추천 모델 랭킹 모델 최적화 생성형 모델 추론예측 모델 등 클라우드 환경에서 데이터를 수집 및 가공하고 모델을 구축 최신 AIMLDL 기술 연구 동향을 파악하여 비즈니스에 접목, 데이터 분석 및 모델링 경력 2년 이상 또는 그에 준하는 역량을 보유하신 분 대표적인 MLDL 모델을 이해하고 특징 및 차이에 대해 이해하고 계신 분 Python SQL R 등의 프로그래밍 언어로 개발이 가능하신 분 문제를 해결하기 위해 스스로 필요한 데이터를 정의 확보 및 분석할 수 있는 분 명확한 문제정의를 바탕으로 해결 방법을 고안하고 분석한 결과를 효과적인 커뮤니케이션 스킬을 통해 전달 할 수 있는 분 내가 제안한 설계와 개발한 코드에 대한 비판에도 열린 커뮤니케이션이 가능한 분 헬스케어 관련 데이터에 대한 경험이해가 있는 분 MLOps를 이용하여 실제 서비스를 운영 해본 경험이 있으신 분 주도적으로 문제를 해결하고 개선하고자 하는 의지를 가진 분 헬스케어 도메인에서 무언가를 이뤄보고 싶으신 분
 ESSEnergy Storage System의 주요 Software 개발 배터리 전력변환장치 제어 및 주변 기타 장치 모니터링 실시간 전력 데이터 수집 및 분석, 정보통신컴퓨터소프트웨어 등 관련 분야 학사 이상 프로그래밍 관련 경력 2년 이상  CC 프로그래밍 언어의 숙련된 활용 능력 네트워크 프로그래밍 숙련자 데이터베이스MySQL ORACLE MSSQL 등 연동 개발 경험 전력 계통 관련 개발 경험 Python Ruby 등 인터프리터 언어 숙련자 Linux UNIX 시스템 활용 능력 보유자 외국어영어 능력
 VitalCare의 벡엔드 시스템 설계 및 개발 Python Golang을 이용한 서비스 구축 및 유지보수 MySQL MongoDB 와의 통합 및 데이터 처리 병원 내의 의료 데이터를 안전하게 처리하고 저장하기 위한 기술적인 솔루션 제공 성능 최적화 및 보안 이슈에 대한 지속적인 모니터링과 개선 테스트 코드 작성 및 유지보수 테스트 자동화를 통한 서비스와 코드 품질 보장, Python 또는 Golang을 활용한 백엔드 개발 경험이 5년 이상 또는 그에 준하는 경험 FastAPI 경험 또는 그에 준하는 프레임워크 경험 MySQL및 MongoDB 를 사용한 데이터베이스 설계 및 구현 경험  MongoDB는 중요도 낮음 테스트 코드 작성 경험 백엔드 아키텍처 설계 및 최적화에 대한 이해 ithub을 통한 CI 및 docker 이미지를 통한 CD 경험 또는 이해 의료 데이터 처리에 대한 경험 및 의료 환경에 대한 지식 우대 테스트 코드 작성 및 테스트 자동화에 익숙 Onpremise 환경 및 Cloud 환경에서의 작업 경험 AWS GCP Azure 등 팀 성장을 고민하시는 분
 제일제당 CRM 플랫폼 개발운영Data Engineer 데이터 분석 파이프라인 개발 및 운영데이터 수집 및 분석 클라우드 기반 데이터 처리 및 최적화 관리,Experience 데이터 파이프라인 구축 경험 프로세스 제안 개선문제점 분석 및 해결 방안 도출 경험 B2C IT 서비스 및 CRM 경험Skill  Knowledge AWS 구성 요소에 대한 경험Lambda Athena Airflow Glue SageMaker S3 등 Cloud 기반 DW Snowflake 등 활용 경험 PythonJAVA 프로그래밍 언어 능숙 및 ML 모델 이해Experience 프로젝트 PMPL 경험 적극적이며 긍정적 태도Skill  Knowledge 컴퓨터 공학 및 전산 계열 전공자 AWS 아키텍처 설계 또는 운영 경험 컨테이너 기반 개발 환경 및 MSA 기반 인프라 활용 경험 DevOps 관련 도구와 방법론Git CICD 등에 대한 지식 및 경험
사용기술Java C C Python 산업용 장비 데이터베이스 구축 및 서버관리데이터 운영, 학력 대졸 이상 전공 컴퓨터공학과 소프트웨어과 등 경력자인 경우 프로젝트 진행이 가능한 개발언어JAVACCPython 능력 보유자 프론트엔드 및 백엔드 등 웹개발 경험 네트워크 구축 및 시스템 구축 신재생에너지 및 장비제어 관련 경력자 공공기관 프로젝트 경험
삼성전기 수원 프로젝트 MES 프로젝트로 제품이 생산되는 일련의 공정들에 대한 UI단을 개발MSS 프로젝트로 설비와 MES 간의 Dashboard를 개발하는 역할로써 UI와 DB를 모두 컨트롤하는 업무면접 후 상기 적합도에 따라 포지션 배치,학력  무관수원 삼성전기 근무 가능자JAVA Xplatform 사용 우대  MES 경력 우대C Net 사용 우대C 런처 개발 우대스마트팩토리 관련 개발운영업무 경험관련 학과 전공자 정보통신공학 컴퓨터공학유관업무 경력자
 iOS APP 서비스의 분석 및 개발 테스트 및 지속적인 최적화를 담당합니다 UX 디자이너와 협업하여 화면 디자인 및 프로세스에 대해 논의합니다 APP 개발 워크플로를 연구하고 개선합니다, Swift로 개발 가능하신 분 iOS 앱 개발과 유지보수 배포 경험이 1년 이상 진행 경험 있으신 분 네이티브 지원 기능에 대한 이해가 높으신 분 개발 목표에 대한 책임감이 있으신 분 주도적으로 문제를 해결하고 책임감 있으신 분 코드 퀄리티에 지속적으로 고민하시는 분 새로운 기술에 대한 관심과 습득사용에 능동적인 분 코드리뷰 경험 있으신 분 Modular Architecture 대한 이해 MVVM 사용하여 프로젝트 진행 경험 SPM 대한 이해 CICD 경험 단위 테스트 경험 컴퓨터 공학 전공
 광고 SDK 개발 및 유지보수 인하우스 서비스 iOS 개발, 컴퓨터공학 전산학 수학 등 직무 관련 전공자 유관 경력 3년 이상 1차 면접에서 포트폴리오 필수 제출 광고 솔루션 경험  초기 앱 서비스 개발 경험
 UXP에서 담당하는 뱅크샐러드의 네이티브 기능 개발을 진행합니다 뱅크샐러드의 주요 제품인 홈 가계부 종알림 화면을 개선하고 새로운 기능을 추가합니다 Push Notification 딥링크 관련 기능을 개선하여 유저가 기능을 빠르고 쉽게 접근할 수 있도록 합니다 개발 생산성 작업을 담당합니다 Web과 Native 간의 interface를 유지보수하여 WebView 기반의 서비스를 안정적으로 운영할 수 있도록 합니다 프로젝트 내 같은 관심사를 갖는 코드의 모듈화 작업을 진행합니다 iOS Chapter 내 코드리뷰에 참여하여 코드 퀄리티 향상에 기여하고 기술 토론을 통해 Best Practice 를 논의하여 개발 생산성을 향상시킵니다 뱅크샐러드 iOS 엔지니어 iOS Engineer는 아래의 , iOS 개발경험이 4년 이상이거나 그에 준하는 실력을 보유하고 있으셔야 합니다 Swift 언어에 대한 높은 이해도를 기반으로 제품을 출시한 경험이 있으셔야 합니다 반응형 프로그래밍 eg RxSwift Combine의 경험이 필요합니다 앱 아키텍처에 대해 고민하고 적용했던 경험이 있으셔야 합니다      MVVM MVP 등의 디자인패턴을 적용해본 경험      공통적으로 쓰이는 코드를 모듈화한 경험 등 Apple Human Interface Guidelines에 대한 이해가 필요합니다 UnitTest 작성 경험이 있으셔야 합니다 다양한 CrashReporting Analytics 도구들을 이용하여 문제를 분석하고 해결할 수 있어야 합니다 Xcode에서 제공하는 View hierarchy Memory graph Debug navigator 등을 이용한 이슈 해결 경험이 있으셔야 합니다 프로젝트에서 필요한 외부 라이브러리를 적절한 요구조건에 맞게 선택하고 검증 및 적용할 수 있어야 합니다 AB 테스팅을 위한 도구사용 및 코드분기 경험이 필요합니다 접근성에 대한 이해가 있는 분을 우대합니다 CICD 설계 및 유지보수 경험이 있는 분을 우대합니다 모듈화 등을 통해 전반적인 프로젝트 관리 및 유지보수성을 높인 경험이 있으면 더욱 좋습니다 10명 이상의 엔지니어와 함께 6개월 이상의 프로젝트에 깊게 참여했던 경험을 우대합니다 Instrument 등을 사용하여 디버깅 난이도가 높은 이슈를 해결한 경험이 있으면 더욱 좋습니다 새로운 기술이나 개발 패러다임에 관심있고 꾸준히 학습하는 분이면 더욱 좋습니다 오픈소스 프로젝트에 기여한 경험을 우대합니다 내 작업물을 문서나 외부 공유용 Readme 블로그 등 으로 기록하고 업데이트 하는 습관을 가지신 분이면 더욱 좋습니다
 Android 앱 개발 iOS 앱 개발 Web 개발 서버개발, Android  iOS 배포 경험 및 개발유지 보수 경력 있으신 분 Android  iOS 아키텍쳐 설계 및 소프트웨어 디자인 패턴에 대한 이해도가 있으신 분 Web 개발의 경우는 Vuejs React Anglar 또는 이에 준하는 프레임워크 관련 경력이 있으신 분 코드 리뷰와 지식 공유에 적극적이신 분 문제 해결 및 코드 품질 개선에 적극적이신 분 Kotlin  Swift 개발 언어에 능숙하신 분 축구 좋아하시는 분 호날두 좋아하시는 분 호날두 싫어하시는 분 Z  D 아시는 분
 메시징 기반 모바일 앱 개발 Lysn 및 디어유 버블 서비스 기능개발 및 유지보수 리팩토링 및 아키텍처 개선, ObjectiveCSwift을 이용한 네이티브 앱 서비스 개발 경력자 Custom UI 및 다양한 디자인은 UIUX 개발 경험자 상용 서비스 개발 및 유지보수 경험자 RESTFUL API에 대한 기본적인 이해를 가지신 분 MVPMVVM 등 디자인 패턴에 대한 이해와 경험 AACAndroid Architecture Components를 통한 개발 경험자 Live StreamingHLS RTSP 등 Client 개발 경험자 오픈소스 분석 및 사용 경험자 메신저 앱 개발 경험자
동영상 편집 앱 VDIT을 더욱 안정적인 앱으로 업그레이드해주실 iOS개발자를 찾고 있습니다  동영상 편집 앱을 개발합니다  Swift를 이용한 UI 개발 및 이미지 영상 처리 기능 개발  비디오 컴포지션 파이프라인 최적화 또는 구성  iPad Mac 사용성 대응 앱 개발  앱 제작 전반에 대해 밀접하게 참여합니다, 5년 이상의 객체지향 프로그래밍 경력 3년 이상의 iOS 개발 경력 혹은 그에 준하는 실력  사진 비디오 촬영을 즐겨하며 비디오 편집 프로그램에 대한 이해도가 높은 분  동료와 소통하며 지속적으로 앱 개선하는 것을 즐기시는 분  계획적으로 일을 진행하여 꼼꼼하게 처리할 수 있는 분  자신이 맡은 분야를 주도적으로 이끌어 나갈 수 있는 분 이미지 영상 처리 개발 경험이 있는 분  코드 개선 자동화 아이디어가 샘솟는 분  iOS 디자인 가이드에 대한 깊은 이해를 갖고 있는 분  동영상 편집 앱 관련 업무 경험  Asana Slack Notion 사용 경험  온라인 커뮤니케이션 능력이 높은 분
1 프로젝트 품질 산출물문서 및 소스 운영 및 관리2 테스트 환경 구축 테스트 케이스테스트 가이드 작성 및 자동화 방안 수립3 불량 원인 분석 및 개선 대책 수립,1 학력 학사 이상2 전공 전기전자 컴퓨터공학 기타 3 CCpython 프로그래밍 가능하신 분4 전장 센서 및 HWSW 개발 품질관리 경력 5년 이상인 분 5 품질관리 계획 수립 실행 분석 및 문서화 경험이 있으신 분1 소프트웨어 검증 자동화 구축 경험과 정적동적자동화 툴 사용 경험이 있으신 분 2 전장 소프트웨어 검증 프로세스에 대한 이해 및 경험이 있으신 분 3 테스트 이슈 관리 도구 BTS 툴 사용 경험이 있는 분Jira Slack Confluence 등4 원활한 의사소통 스킬 및 적극적인 협업 능력을 보유하신 분
UNITY 클라이언트 개발, 학력   학사 이상석박사 우대  전공 무관 나이성별  무관 경력  경력 37년 이하 ᆞ각종 asset을 사용하여 client 개발ᆞC 사용 개발자ᆞ컴퓨터시스템공학 전공자ᆞ정보처리기사 보유자ᆞAgile 개발방법 경험자ᆞWebRTC WebGL 경험자ᆞPMPL 경험 유경험자ᆞ협업 및 원활한 커뮤니케이션 능력을 갖춘 자
로 검사기 관리 응용 프로그램 개발  설치 및 유지보수 입니다머신비전 관리 솔루션 개발 C  Winform검사데이터 처리 및 GUI 개발Serial Ethernet PLC 등의 IO Interface 모듈 개발 MES 연동 개발HW 팀을 지원하여 SW가 원활하게 동작하게끔 지원 필요시 고객사 출장 업무지원머신비전 검사 솔루션 개발 C  MFC검사알고리즘 개발 및 성능 최적화검사 솔루션 GUI 개발검사 관리 솔루션과의 통신 Interface 및 IO Interface 모듈 개발 HW 팀을 지원하여 SW가 원활하게 동작하게끔 지원 필요시 고객사 출장 업무지원,SW 개발 경력 2년 이상 신입이면 석사 졸업C  C 중 1개이상 사용가능정해진 시간내에 문제해결 능력을 가진 자끈기 있고 도전하는 자국내 및 해외출장 가능자광학전기전자기계컴퓨터공학 전공 우대MFC  OPENCV  상용 비전라이브러리 경험자 우대PLC 연동  sqlite  json 경험자Git 소스코드 관리 경험자운전가능자 해당직무 근무경험 석사학위 수여자
  Cloudv Iwinv ivyro 고객 기술 지원  Linux 시스템 장애 처리   Web DB 등 서비스 유지 보수 ,  IT 기술 서버 전반에 대한 이해 기본적인 Linux 시스템에 대한 이해 apache nginx php 등 전반적인 서비스에 대한 이해초대졸이상 또는 졸업예정자해외여행에 결격사유가 없는자   Linux 마스터 또는 관련 자격증 보유자   관련 학과 전공 또는 서버운영 관련 교육 이수자  고객사와의 기술적 커뮤니케이션 경험 有
 미디어 아트 개발 및 인터렉티브 프로그래밍 라이팅  센서  영상  모터 제어 등 외부 장치와 연동 미디어서버 구축, 프로그램 개발 경력 3년 이상 다양한 객체지향 프로그래밍 지식과 경험 새로운 기술 또는 기기의 활용을 즐기는 분  새로운 것에 대한 두려움 없이 RD를 즐기는 분 비주얼 감각 및 공간을 이해하는 분 미디어아트 영역에 관심이 많으신 분 3D 게임엔진언리얼 유니티 프로그램 개발 경력자 아두이노 센서 등 하드웨어 연계 작업 경험자 기구설계 및 키네틱 개발 경험자 DMX ARTNET 조명장치 제어 경험자 GIT SVN 등 파일 관리 소프트웨어 사용 가능자
 SLAMNAVIGATIONFMS 프로그램 개발 및 고도화 로봇 태스크 프로그램 개발 및 고도화 로봇 운영 및 테스트서빙로봇 AMR 등  로봇 사용 교육 및 업체 기술 지원 정부과제 수행 오더피킹 로봇, SW 로봇공학 로봇제어 관련 학과 석사 이상 SLAMNavigationFMS 프로그램 직접 개발 이력 보유 Web SW 개발 경험 보유
 미소 서비스의 Infrastructure 운영 고도화 업무 개발운영 생산성 향상 업무자동화를 위한 CICD 개발 일반적인 시스템 보안 및 해킹 위협에 대응 다양한 데이터 소스에 대한 접근 통제 및 보안 서비스 및 인프라 모니터링 시스템 구축 및 운영 프로덕션 환경에서 발생하는 모든 기술 이슈에 대응, DevOps 혹은 이와 유사한 관련 경력 2년 이상 개발의 생산성과 성능를 차이를 이해며 적절한 도구를 사용하시는 분 데이터에 기반한 의사결정과 대화를 추구하시는 분 여러 개발 언어를 경험해 보신 분 AWS KubernetesEKS Terraform 경험 우대 CICD 특별히 GitHub Actions 활용 경험이 있으신 분 CloudWatch Datadog 등을 활용한 시스템 모니터링 로깅 및 알람 AWS Certification 우대
중국 제조사와 Technical Contact Local Technical Support 퍼스널 모빌리티 신규 프로젝트 테스트퍼스널 모빌리티 하드웨어 문제해결을 위한 기술지원유지보수 프로젝트 계획 및 관리펌웨어 개발 및 유지보수,학력  대졸이상 메카트로닉스 전기 전자 기계 관련학과 졸업자경력  관련경력 2년 이상운전면허를 소지한 분근무지화성시 동탄 영천동 출퇴근이 가능한 분외국어 능통자중국 혹은 미국 업체와 메일 소통 가능한 분서비스 엔지니어 혹은 기술지원 관련 업무 경력자
자사 보안 솔루션 기술 지원구축유지보수 및 침해 분석,학력  초대졸 이상경력  신입 또는 1년 이상해외 여행에 결격 사유가 없는 자Linux RDBMS Network 침해 로그분석 보안기술 등 지식 학습에 의욕이 강한 인재리눅스 관련 지식 보유 및 경험한 자정보보호 MariaDB 지식 보유자보안관련 자격증 정보보안기사 리눅스마스터1급 등 소지자 우대긍정적이며 원활한 커뮤니케이션이 가능한 인재
인 월 결산 기능 고도화 및 모듈 관련 업무 문의 대응 및 시스템 개선  반복되는 비효율 업무 정기 개선 진행  대량의 데이터 인터페이스 방식 개선 및 프로그램 튜닝 작업 수행 다양한 SAP 시스템 프로젝트를 수행 가능  SAP ITO 수행을 통해 고객 개선 과제 및 SM 프로젝트 경험  SM 프로젝트  해외 법인 확장하는 프로젝트까지 개인 의사에 따라 진행 가능  프로젝트 수행을 통해 운영 업무에서 접할 수 없는 SAP의 다양한 기능을 경험할 수 있으며  SAP 전문가로 성장 가능성 높음, Experience  SAP MM SD PP 모듈 중 1개 모듈 운영 경력 3년이상  ABAP 개발 및 IMG 세팅   모듈 개별 채용 진행   Skill  Knowledge  고객과의 원활한 커뮤니케이션 ERP시스템 SCM 전문 지식 및 운영 경험  물류 프로세스 이해  SAP S4HANA 기반 프로젝트 경험 및 프로젝트 리딩 경험
 자사 AI 음성인식 솔루션 엔지니어 자사 패키지 SW 엔지니어로서 기술지원 서버 구축 유지보수 장애처리 등 서비스 운영, Linux WEBWAS 유경험자 Python Django Docker 경험하신 분 Devops CICD 애자일을 경험하고 이해하시거나 하고 싶으신 분 개발언어에 대한 소양을 갖추신 분 음성인식 솔루션 경험이나 이해도가 있으신 분 헬스케어 솔루션서비스 유경험자
제품 배포 패키징 및 고도화엔지니어 피드백 수집 및 제품 개선제품 문서화 및 내부 교육제품을 이용한 내외부 기술 지원,5년 이상 10년 이하의 관련 경력이 있으신 분Cloud 나 Onprem 환경에서 Linux 기반 제품 전문가로의 경력이 있으신 분프로그래밍 및 스크립팅 기술python bash 등 이 있으신 분컨테이너 기술 예 Docker Kubernetes 및 클라우드 플랫폼 예 AWS Azure GCP 경험 및 이해가 있으신 분무엇이든 배워서 사용할 수 있다는 마인드를 가지신 분다양한 팀과 효과적으로 협력하기 위한 탁월한 커뮤니케이션 능력컴퓨터 과학 정보 기술 또는 관련 분야의 학사 학위 또는 동등한 경력기술 담당자와의 컨퍼런스 콜 채팅 이메일 등 영어 커뮤니케이션이 가능하신 분알고 있는 지식을 체계적으로 문서화하는데 익숙하신 분
 AWS 기반의 인프라 설계  구축  운영  클라우드 엔지니어 업무 수행 모니터링을 통한 시스템  서비스 성능 개선 서버네트워크 인프라 환경의 보안 검토 및 적용, 3년 이상의 시스템 엔지니어Cloud DevOps 경력  Public Cloud AWS Azure GCP 구축  운영 경험 및 지식 보유  리눅스 운영 경험 및 OS  Network 기본 지식 보유 영어 가능자  필리핀 현지 엔지니어들과 협업 및 가이드 문서 제공에 필요
 CICD 파이프라인 구축 및 통합   사내 클라우드 인프라 환경 운영   서비스 자동화 환경 구성   자사 제품 패키징  ,  Docker Kubernetes 등 컨테이너 기반 플랫폼 환경에 대한 경험이 있으신 분   하나 이상의 프로그래밍 언어 지식을 보유한 분  멀티 클라우드 인프라 환경에 대한 서비스 및 구축 경험이 있으신 분   네트워크 보안에 대한 이해와 경험을 보유한 분   CICD 파이프라인 구축 경험을 가지신 분   Terraform Ansible과 같은 IaC 사용 경험이 있으신 분   Istio와 같은 Service Mesh에 대한 경험이 있으신 분   모니터링 및 로깅 시스템 구축 관련 경험이 있으신 분 
 미소 서비스의 Infrastructure 운영 고도화 업무 개발운영 생산성 향상 업무자동화를 위한 CICD 개발 일반적인 시스템 보안 및 해킹 위협에 대응 다양한 데이터 소스에 대한 접근 통제 및 보안 서비스 및 인프라 모니터링 시스템 구축 및 운영 프로덕션 환경에서 발생하는 모든 기술 이슈에 대응, DevOps 혹은 이와 유사한 관련 경력 2년 이상 개발의 생산성과 성능를 차이를 이해며 적절한 도구를 사용하시는 분 데이터에 기반한 의사결정과 대화를 추구하시는 분 여러 개발 언어를 경험해 보신 분 AWS KubernetesEKS Terraform 경험 우대 CICD 특별히 GitHub Actions 활용 경험이 있으신 분 CloudWatch Datadog 등을 활용한 시스템 모니터링 로깅 및 알람 AWS Certification 우대
최신 기술 트렌드 파악 및 POC 확인프로젝트 관리 및 팀 관리딥러닝 기반 인식 네트워크 개발컴퓨터 비전 기반 ADAS 알고리즘 개발3D vision 알고리즘 개발,학력전공  석사 이상경력  석사 7년 이상  박사 5년 이상프로그래밍 언어  Python CC관련 전공 석박사 학위 수여자딥러닝 네트워크 임베디드 포팅 경험자컴퓨터비전 알고리즘 개발 경험자PyTorch Git Docker 사용 가능자
사용 기술 Python SW C  C Network java 산업용 장비 SW 통신 네트워크 구축 및 시스템 구축, 학력 대졸 이상 전공 컴퓨터공학과 소프트웨어과 등 경력자인 경우 프로젝트 진행이 가능한 개발언어JAVACCPython 능력 보유자 프론트엔드 및 백엔드 등 웹개발 경험 네트워크 구축 및 시스템 구축 신재생에너지 및 장비제어 관련 경력자 공공기관 프로젝트 경험
