주요 업무,자격요건 및 우대사항
 Notiforce 메시지 알림 솔루션 운영 및 개발고도화기술 스텍JAVA 18  Spring boot 2 JPASpring 4  MVC Pattern Servlet 이해 JSP MybatisVuejs 3  HTML Javascript CSSMariaDB, Spring Boot를 이용한 개발 경험 JPA Hibernate 기반 개발 경험 RDBMariaDB 기반 개발 경험 ORM Framework Mybatis 기반 개발 경험 Vuejs 를 이용한 화면 개발 경험 Git Jira를 이용 협업 개발 경험 메시징서비스 구축 또는 운영경험 Linux 환경 구축 경험 또는 운영경험 AWS 환경 구축 경험 또는 운영경험 Git JenkinsCICD 구축 및 운영경험 Slack Jira 사용경험
UNITY 클라이언트 개발, 학력   학사 이상석박사 우대  전공 무관 나이성별  무관 경력  경력 37년 이하 ᆞ각종 asset을 사용하여 client 개발ᆞC 사용 개발자ᆞ컴퓨터시스템공학 전공자ᆞ정보처리기사 보유자ᆞAgile 개발방법 경험자ᆞWebRTC WebGL 경험자ᆞPMPL 경험 유경험자ᆞ협업 및 원활한 커뮤니케이션 능력을 갖춘 자
 카메라 모듈 제조 및 검사 설비 SW 개발 자동화 설비 및 머신비전 SW 개발,학력사항 2년제 초대졸이상석사 우대채용형태 정규직요구자격증  무관연령대  성별  무관  남성어학능력 무관 영상처리 머신비전 SW 개발 경험자 모션제어 SW 개발 경험자 C개발 가능자 해외 출장 가능자컴퓨터기계전기전자공학 공학계열반도체 및 디스플레이 제조 등 자동화 설비 제어 SW 개발 경험자OpenCV Cognex Halcon 비젼 라이브러리 경험자AJIN COMIZOA 모션 제어 경험자석사이상 학위 보유자인근거주자 컴퓨터활용능력우수 운전가능자 해당직무 근무경험
자동화 및 HW제어관련 SW 개발업무,학력사항 4년제 학사이상2년제 전문학사도 가능채용형태 정규직요구자격증  무관연령대  성별  무관  남성어학능력 무관1 자동화 설비제어2 Mchine Vision OpenCV etc Vision 알고리즘 개발경험 우대3 HW제어4 Programming Language  C 또는 C 가능자5 기타  해외출장 가능자컴퓨터기계전기전자공학 공학계열반도체 및 디스플레이 제조 등 자동화 설비 제어 SW 개발 경험자OpenCV Cognex Halcon 비젼 라이브러리 경험자AJIN COMIZOA 모션 제어 경험자석사이상 학위 보유자인근거주자 컴퓨터활용능력우수 운전가능자 해당직무 근무경험
 ARCHISKETCH XR  3D 개발,     Typescript React Redux     Threejs PixiJS     Rust WebAssembly 우대 AWS Git 사용 경험 보유자  열정없이 못사는 분 스타트업 근무 경험이 있으신 분 홈인테리어에 대한 관심도가 높고 관련 서비스 경험이 있으신 분
 자사 이커머스  O2O 서비스 개발 앱웹 환경을 위한 API 개발 리드 신규 project 기획 관리, 유관 경력 5년 이상 타부서와 원활한 커뮤니케이션 능력 다양한 project 리드관리 경험 쇼핑몰 플랫폼 컨텐츠업종 개발운영 경험자 주도적으로 업무를 진행하시는 분
잠깐 저희는 TL과 EM이 나뉘어져 있어요 Tech Lead는 문제를 해결하기 위한 최적의 방법을 조언합니다 문제 정의와 그에 따른 요구사항 정리 시스템 설계 운영까지 기술에 관련된 부분을 함께 개발하고 논의하며 돕습니다 Engineering Manager는 일을 효율적으로 진행하기 위해 PM과 함께 일정 관리를 돕고 팀원을 지원합니다EM은 이런 일을 함께 해요 태스크 관리 Task managing     업무 진행 상황을 추적하며 진행에 방해되는 요소 제거     정확한 일정을 산정할 수 있도록 PM과 실무자 지원     회사조직의 전략적 방향성을 고려하여 우선순위 설정 팀 관리 People managing     정기적인 1 on 1 회고 등을 통한 빠른 피드백     구성원들의 멘탈을 케어해주고 커리어를 함께 고민     상향식하향식 커뮤니케이션을 원활하게 만들고 구성원 간의 라포를 형성하도록 지원, 대용량 트래픽을 경험한 분 규모가 있는 엔지니어링 조직을 이끌어 본 분 데이터 분석과 그에 기반한 사고를 하실 수 있는 분 멘토링 경험이 있으신 분 애자일을 경험한 분 Typescript 사용 경험 GraphQL 또는 Rest API 사용 경험 React native 혹은 native app 개발 경험 백엔드에 대한 이해
 차량 제어기 MATLAB Simulink 모델 개발 및 검증 차량 제어기 SW 정적동적 검증 차량 제어기 SW 설계문서 작성, C언어 가능자코드 해석 가능자 미래 모빌리티의 핵심인 SDVSoftwaredefined Vehicle SW 개발 및 검증에 관심이 있는 지원자 코드 분석 및 리뷰정적 검증에 경험 보유 및 관심 있는 자 테스트케이스 설계 및 검증동적 검증에 경험 보유 및 관심 있는 자 MATLAB Simulink 모델에 관심이 있거나 활용 경험자 임베디드 SW 개발 경험 및 이해 보유자 SW 설계문서요구사항 아키텍처 상세 설계 작성 경험 보유자 컴퓨터 소프트웨어 전기 전자 정보통신 등 SW 관련 전공자
 차량 제어기 HW 검증을 위한 Test Software 개발 차량 제어기 디바이스 드라이버 개발, C언어 가능자초급 이상 개발자 미래 모빌리티의 핵심인 SDVSoftwaredefined Vehicle SW 개발 및 검증에 관심이 있는 지원자 임베디드 SW 개발 경험 및 이해 보유자 디버거Trace32 관련 사용 경험자 MCU Peripheral Device driver 이해자 컴퓨터 소프트웨어 전기 전자 정보통신 등 SW 관련 전공자
 실내외 로봇 인지 판단 제어 시스템 SW 개발 ROS Linux PythonCC 기반 로봇시스템 개발 자율주행 실내외 로봇 알고리즘 개발 관제시스템 UIUX 개발, Python C C 개발 경험 프로젝트 진행 및 협업 역량 Python C C 개발 경험자 WindowsLinux 기반의 로봇시스템 개발 경험자 관련 프로젝트 및 업무 경험자 관련 전공 석박사 학위 보유자 커뮤니케이션 능력 문제 해결 능력 보유자
  우분투1804리눅스 기반 차량용 녹화프로그램 개발  AWS S3 데이터 업로드 각종 센서 데이터 처리 App 개발  Device Driver 개발, 임베디드 리눅스 개발 경력 5년 이상 CC 프로그래밍 가능자 오픈소스 포팅 유경험자 협업 및 유연한 커뮤니케이션 스킬 보유자
 ServerlessContainer 등 다양한 AWS Managed 서비스를 사용하여 로직 구현 AWS IoT CoreEventBridge를 사용하여 엘리베이터 TV 관리 및 통제 시간 장소 상황에 따른 맞춤형 영상 송출을 위한 알고리즘 로직 개발 및 구현 다양한 내외부 서비스와 연결할 수 있는 APISDK 개발 효율적인 미디어 전송 시스템 구현, 소프트웨어 개발 관련 5년 이상의 업무 경력을 보유하신 분 1개의 개발 언어를 5년 이상 사용한 경험이 있으신 분 JavaSpring Kotlin JavaScriptTypeScript 및 다양한 Data Source 에 대한 경험을 보유하신 분 운영 체제 소프트웨어 디자인 패턴 고가용성 및 확장성에 대한 이해도가 높으신 분 SQS SNS DynamoDB Neptune 등 다양한 AWS 클라우드 기반 서비스를 사용한 개발 및 운영 경험을 보유하신 분 개발 및 운영에서 발생하는 다양한 장단기 문제 해결 경험을 보유하신 분 AWS Developer Certification 또는 유사한 자격증을 취득하신 분 원활한 커뮤니케이션 능력을 보유하신 분 GitHub 링크 제출 必 제품 개발 업무 전반을 5년 이상 경험하신 분 5년 이상의 풀스택 개발 업무 경험을 보유하신 분 컴퓨터 사이언스 또는 관련 분야를 전공하신 분 업무 과정에서의 센스와 예리함을 갖추신 분 클라우드 기반 시스템 디자인 경험을 보유하신 분 페어 프로그래밍 경험을 보유하신 분
 회사의 목표와 동료의 목표를 정렬하여 필요한 소프트웨어 개발 및 유지하는 조직 운영 요구되는 기능을 가장 작은 단위로 분할하여 목표한 시간 내에 배포할 수 있는 체계 수립 다양하게 발생하는 문제를 동료들과 함께 논의하여 해결 다양한 시스템소프트웨어 디자인 및 도메인 비용 효율적인 실패성공 관리, 소프트웨어 개발 관련 10년 이상의 업무 경력을 보유하신 분 10년 이상의 풀 사이클 제품 개발 업무 경험을 보유하신 분 코드 리뷰 소스 코드 베이스 관리 빌드 프로세스 테스트 및 배포한 소프트웨어의 프로덕션 운영 조직 리드 3년 이상의 소프트웨어 개발 조직 운영 경험이 있으신 분 다양한 언어 및 프레임워크 Data Source 에 대한 경험과 이해가 있으신 분 다양한 AWS 클라우드 기반 서비스를 사용한 개발 및 운영 경험이 있으신 분 SQS SNS DynamoDB Neptune 등 GitHub 링크 제출 必 5년 이상의 풀스택 소프트웨어 개발 경험을 보유하신 분 Java JavascriptTypeScript React 등 컴퓨터 사이언스 또는 관련 분야를 전공하신 분
 System SW 개발 Embedded linux FW Application 개발 Cloud 연동 개발, 경력  38년 대리과장급 학력  학사이상 Embedded Linux 개발 경험자 공학 전공자
MOLOCO seeks talented engineers to join our SRE team The team is building and evolving a highly scalable costefficient and low latency platform that leverages stateoftheart Cloud technologies to sustain our evergrowing mobile ads ecosystem Our platform handles 5 million requests per second which is about 80X of Google search traffic This immense volume of workload is giving us unique and challenging problems to solve in terms of scalability and reliability As a member of the SRE team you will be given chances to solve these huge challenges with the actual engineers who built the platform and with cuttingedge technologiesAs a company founded by Software Engineers we understand the value of a strong engineering team and strive to hire only the best talent While tackling challenging realworld problems you will make a positive impact on millions of mobile users in the world and grow with topnotch colleagues Check out our case study published by Googlehttpscloudgooglecomcustomersmoloco,  Lead the businessaligned decisions on the infra launch  Lead the multiteam project for the infrastructure improvement  Design  implement strategies for managing company resources in terms of reliability availability and costeffectiveness  Establish and evangelize the highest level of operational excellencies  Proactively find the risks and craft solutions to mitigate them  6 years of SREDevOps development experience in ITrelated areas  Bachelors or Masters degree in Computer Science Computer Engineering or related major  Knowledge of SREDevOps best practices  Experience with tools such as Kubernetes Terraform Jenkins GitHub Actions etc  Software development skills in at least one programming language  Outstanding problemsolving skills  Experience working with realtime systems and highly scalable software architectures  Experience with Cloud service providers such as GCP AWS or Azure
Automotive 차량용 SW개발 Linux Middleware BSP,대졸 이상 학력CC개발OOP객체지향 프로그래밍 개발 경험 및 지식이 있는 분원활한 소통이 가능하신 분개발에 대한 향상심이 있으신 분관련 학과 졸업하신 분  전자공학과 전공자  정보제어통신공학 전공자Visual Studio를 사용한 개발 및 디버깅 경험이 있으신 분업무에 대한 책임감이 있으신 분해외여행에 결격사유가 없는 분외국어영어에 능통하신 분
Automotive 차량용 SW개발 Linux Middleware BSP,대졸 이상 학력자동차용  SW 개발 경험무선 통신 개발 경험 BluetoothWifi로그를 이용한 디버깅 경험GitRepo등 형상관리툴 사용 경험GENIVI 플랫폼 사용 경험공학계열 전공영어 커뮤니케이션 능통BSP Embedded Linux Softwareframework 개발 및 유지보수 경험하드웨어 엔지니어와의 협업 경험Yoto기반의 소프트웨어 개발 환경 경험 CC 개발 경험Bluetooth Embedded Linux Softwareframework 개발 및 유지보수 경험SPIUART 통신 인터페이스 제어 경험 타모듈 Part와 협업 경험CC 개발 경험
Automotive 차량용 SW 개발 프로젝트 운영,Automotive 차량용 SW개발 경험Embedded Project PM 경험 5년 이상Software 기술 고급 경력자 이상문제 해결 협업 역량이슈 관리 시스템 사용 경험  Jira Asana 등그 외 개발 Tool 사용 경험해외 출장에 결격사유가 없는 분외국어영어에 능통하신 분
  ESL server Backend 개발 RDBMS  NoSQL DB 구축운영 Slow Query 분석 등 성능 평가,학력  석사 이상 컴퓨터 전산 관련 전공  java Programming 능력 필수 Nodejs 또는 Spring framework 기반 Application 개발 경험 Web Application 개발 경험 Azure SDK 기반 SW 개발 경험 리눅스 시스템 및 네트워크에 대한 기본적인 이해와 경험 영어 가능자 인도 개발인력과의 협업 및 기술개발문서 작성
 비전 검사 시스템 유지 보수 및 개선 신규 설비 비전 도입 시 Setup 지원, 비전 관련 업무 경험자 컴퓨터시스템공학 전공자 이미지 프로세싱 영상처리 개발 경험자 Cognex 프로그램 사용 경험자
 인공지능 네트워크 설계 및 최적화 인공지능 네트워크 구동을 위한 소프트웨어 개발, 경력 신입 경력연차무관 학력사항 대학교4년 졸업졸업예정 이상 전공 공학계열 경험 인공지능 네트워크를 사용한 과제 수행 인공지능 프로세서NPU관련 과제 수행 경력 추후 협의
 제품 software 개발   제품 제어 사양 정의   제어 분석검증, software 분석 가능 C언어   MCU Coding 개발 중상급 수준 동종업계 software 개발 실무자   SQA업무 경험자
SW 개발자,학력  대졸 이상 2 3년경력  경력필수사항  CWPF 개발 경력자레이저 제어 경력자공장 자동화 개발 경력자모션 제어 경력자RTC 개발 경력자비전 프로그래밍 경력자
DC 전기차 충전기 펌웨어 개발 및 유지 보수전기차 충전 제어 담당충전기 내부 시스템 제어 파워모듈 통신 제어차량과의 통신 제어,C언어 사용 가능자MCU 주변 회로 분석 가능자끈기 인내심 도전 정신 본인이 하는 일에 자부심을 가지고 일하시는 분충전기 개발 관련 업무FW 개발 경험자
공인시험 업무정적동적 시험,CC 개발 경험 보유 소스코드 분석 능력 보유컴퓨터 소프트웨어 전기 전자 정보통신 등 SW 관련 전공자다양한 시스템 및 소프트웨어 시험평가에 관심있는 지원자SW 생명주기  SW 공학에 대한 이해 보유자CC 언어 분석 및 기본적인 개발에 어려움이 없는 분테스팅 및 VV 업무 유경험자테스트케이스 설계 유경험자KOLAS 업무 유경험자
 자동차 SW 엔지니어링 서비스 수행,C 및 C기반 펌웨어 개발 경력 2년 이상펌웨어 기능 검증 또는 제어를 위한 GUI SW 개발 경험자임베디드 시스템에 대한 구조 분석 및 이해가 가능한자SW 공학 관련 교육 경험이 있는 분CC 언어 분석 및 기본적인 개발에 어려움이 없는 분스크립트 언어Python ShellScript 등를 다룰 줄 아는 분 프로젝트엔지니어링 매니저역량을 갖춘 분
 자동차 사이버보안 엔지니어링 서비스 수행, 사이버보안 분야 전공 이수자 국제 표준논문기술문서 등 분석이 가능한 자 자동차 사이버보안에 관심이 있는 자SW 공학 관련 교육 경험이 있는 분CC 언어 분석 및 기본적인 개발에 어려움이 없는 분스크립트 언어Python ShellScript 등를 다룰 줄 아는 분 프로젝트엔지니어링 매니저역량을 갖춘 분
 자동차 분야 검증프로젝트 관리자Project Manager, C언어 가능자 분석가능 자동차 분야 정적동적 검증 또는 시스템 HIL검증 프로젝트 수행 경험자 4인 이상 규모의 프로젝트 관리 경험자MDB기반으로 개발 된 제어기의 검증경험자임베디드시스템 및 자동차 제어기 관련 경험
 웹기반 플랫폼 개발 프로젝트 품질 관리 및 검증,C언어 가능자 개발 및 검증웹 프로그래밍 가능자 SW 검증 및 프로젝트 품질 관리에 관심이 있는 지원자 PMO  QMP 및 프로젝트 관리 경험자 다양한 소프트웨어 및 개발 언어 유경험자 컴퓨터 소프트웨어 전기 전자 정보통신 등 SW 관련 전공자
 자율주행 실차 및 관련 제어 기술 검증 제어기 HILS 검증 및 테스트케이스 개발 검증 환경 구성,C언어 분석 가능한 수준의 초급 개발자 또는 타 프로그래밍 언어 응용 가능자자동차 분야 SW  시스템 검증에 관심이 있는 지원자 자동차 검증에 열정을 가지고 도전하려는 자세 컴ㅍ터 소프트웨어 전기 전자 정보통신 등 SW 관련 전공자
 시스템 검증을 위한 요구사항 기반 테스트케이스 개발 HILSHardwareinthe Loop simulation 장비를 활용한 시스템 검증전기차 하이브리드차 제어기 소프트웨어시스템 검증 국내외 자동차 OEM사와 협업 프로젝트 수행ASPICE인증프로세스 대응,자동차 분야 사양 분석 및 테스트케이스 개발 유경험자자동차 분야 SW검증시스템 검증에 관심이 있는 지원자 임베디드 시스템 관련 이해 보유자소프트웨어 검증 개발 공학 분야 교육 경험 HILS장비 운용 경험자dSPACE검증을 위한 요구사항 사양서 분석 테스트 케이스 설계 경험자CAN 통신 관련 경험이나 Vertocr Tool 사용 경험자엑셀PPT 활용 능력 우수자디버거Trace32 관련 사용 경험자ASPICE 프로세스 경험자자동차 관련 업무 경험자 우대
 자동차 분야 시스템 검증 HILS검증,C언어 가능자 개발 및 검증자동차 분야 시스템 검증에 관심이 있는 지원자요구사양 기반의 통합시스템 검증을 위한 테스트케이스 개발 경험 보유 MATLAB Simulink를 이용한 설계 모델 분석 가능HILS 장비 운용 경험 보유 임베디드시스템 및 자동차 제어기 관련 경험
 원자력 및 철도 SW VV,CC 개발 경험 보유자컴퓨터 소프트웨어 전기 전자 정보통신 등 SW 관련 전공자표준 분석 및 개발 문서 작성 경험 보유자프로그램의 생명주기에 대한 이해가 있는자 원자력 또는 임베디드 시스템 개발 경험FPGA 설계 및 개발 경험QA 테스팅 VV 업무 수행 경험각종 협업 도구 Kanban SVN OneDrive에 경험이 있거나 빠른 학습이해 가능한 자WordExcel 활용능력 우수자 적극적 도전적이고 직무전환실무자관리 자에 문제없는자프로젝트 관리 경험 보유 또는 관리 업무 회망자 경력
 원자력 및 철도 SWVV,CC개발 경험 보유자컴퓨터 소프트웨어 전기 전가 정보통신 등 SW 관련 전공자프로그램의 생명주기에 대한 이해가 있는자 원자력 또는 임베디드 시스템 개발 경험QA 테스팅 VV 업무 수행 경험표준 문서 분석  개발 문서 작성 경험 보유자
국방 SW 검증, C C 프로그래밍 유경험자 C 또는 JAVA 개발 경험자국방 관련 직종 경력자
항공우주 SW 검증, C C 프로그래밍 유경험자 항공우주 관련 직종 경력자영어회화 가능자
코드분석엔진 개발 Abstract Interpretation,과 상관없이 이 분야의 기술에 특별한 매력을 느끼는 분
 단위통합 테스트 솔루션인 CT 개발 및 유지보수 테스트 자동화 도구의 기반 플랫폼 개발 및 유지보수 Java, Java 개발 실무 25년 또는 그에 준하는 역량 보유 객체 지향 설계 경험 각종 협업 도구에 익숙하고 팀워크 기반으로 업무를 수행한 경험 Bitbucket JIRA Notion Slack Jenkins 등 프로그램의 생명주기에 대한 이해 유닛 테스팅 프레임워크 사용 경험 빌드테스트배포 자동화 경험 CC 개발 경험 프로그래밍 언어컴파일러에 대한 이해
 사내 솔루션 DCAT 및 자율 주행 관련 과제 수행 센서 데이터 송수신 기능 데이터 로깅파싱 기능 다종다중 센서 데이터 시간 동기화 기능 개발,경력 1년 이상 C개발자 데이터 통신 관련UDP TCP 개발 경험자 Linux 기반 개발 경험자 개인보다 팀워크를 중요시 하는 성격라이다 레이더 카메라 IMUGPS 등 센서 데이터 처리 경험자QT 개발 경험자새로운 일에 대한 도전적인 태도
CC 정적 분석 규칙 구현  정적 분석 대상 소스코드의 컴파일 정보 추출 어플리케이션 개발,빌드 과정전처리 컴파일 링크 를 설명할 수 있는 지식OOP객체지향 프로그래밍 개발 경험자C 표준에 대한 기본 지식Makefile을 직접 작성하고 관리한 경험정적 분석 도구 사용 경험 컴파일러에 대한 해박한 지식STL 사용 경험과 지식단위 테스트 작성과 관리 경험
차량제어SW 테스트 자동화 도구 개발,SW 관련 전공자SW 개발 경력 최소 2년 이상CWPF 개발 유경험자차량 도메인 SW 개발 경험상품화된 SW 도구 개발 및 유지보수 경험ASAM XIL 표준 관련 지식 보유자
제어기 가상화 개발,C언어 개발 실무 3년차 이상 또는 그에 준하는 역량 보유자Visual Studio를 사용한 개발 및 디버깅 경험자동차 제어기 SW 개발 경험  AUTOSAR 지식 보유Simulink 개발 경험 임베디드 SW 개발 경험
차량 인포테인먼트 시스템 검증도구 VISTA제품개발1 개발언어  Java JNI2 개발환경  이클립스 RCP,학사 학위 취득자또는 24년 2월 예정자경력 2년 이상의 개발자안드로이드 오토모티브 기반 개발검증 경험차량 AVN시험 경험중국어로 기술 설명 가능자석사 학위 취득자
시뮬레이션 소프트웨어 개발 가상센서 로직 개발 시나리 오로직 개발 자율주행SW 인터페이스 개발 등,프로그래밍 언어 C을 이용한 소프트웨어 개발 경험 보유자 자율주행 및 시뮬레이션에 관심이 있는 소프트웨어 개발자 C Python 언어 개발 개발 경험  ROS Linux 환경 개발 경험
 CUBRID DBMS 신규 기능 개발 DBMS 버그 수정 DBMS 관련 기술문서 작성 신기술 관련 조사 및 연구, Linux 환경에서 CCJAVA를 이용한 개발 경험  시스템 소프트웨어에 대한 이해 CUBRID DBMS 사용 경험 DBMS 개발 경험 시스템 소프트웨어 또는 패키지 소프트웨어 분야에서 6개월 이상의 중장기 개발 프로젝트 참여 경험 DBMS 또는 컴파일러 전공석사 이상 CCJAVA 외에 다른 언어PHP Python HTML5 JavaScript 등 개발 경험 영어로 기술 문서 작성 및 회화 가능자기타사항 미필인 경우 전문연구원석사이상 보충역4급이하으로 지원 가능하신 분
 CUBRID DBMS 신규 기능 개발 DBMS 버그 수정 DBMS 관련 기술문서 작성 신기술 관련 조사 및 연구, Linux 환경에서 CCJAVA를 이용한 개발 경험  시스템 소프트웨어에 대한 이해 전문연구요원 요건     병역 미필자로 석사 이상 졸업 및 졸업 예정인 분     타기관에 전문연구요원 재직 중 이직 가능한 분 CUBRID DBMS 사용 경험 DBMS 개발 경험 시스템 소프트웨어 또는 패키지 소프트웨어 분야에서 6개월 이상의 중장기 개발 프로젝트 참여 경험 DBMS 또는 컴파일러 전공석사 이상 CCJAVA 외에 다른 언어PHP Python HTML5 JavaScript 등 개발 경험 영어로 기술 문서 작성 및 회화 가능자
해양용 통신장비 SW 개발  안드로이드 AOSP or STM32 기반으로 CC or Java UI 개발해양용 레이더 및 디스플레이 장비 개발  안드로이드 AOSP 기반으로 CC or Java UI 개발금번 채용 포지션은 정규직 연구원으로 주 근무지는 제2판 교테크 노밸리 본사 소재 연구소이며 FURUNO 일본 본사와 미국 지사와의 협의 하에 FURUNO 사의 제품을 개발하는 업무를 담당하게 됩니다,해양용 전자장비는 장시간의 해양 환경을 견뎌야 하는 높은 신뢰성과 내구성이 필요한 장비이므로 빠른 개발 보다는 높은 완성도를 추구합니다 따라서 FURUNO 사와의 협업 하에서 장기간의 안정적인 스케줄에 따라 전체 개발 과정이 진행 관리되어 잔업 및 야근이 필요한 경우는 거의 없습니다 따라서 팀원들과 함께 보조를 맞추며 자신의 직무에 충실하신 분이면 좋습니다  CAN 통신 유경험자 차량용 소프트웨어 개발 경험 STM32 or 타 MCU 기반 GUI 솔루션 개발 경험 해양용 레이더 디스플레이  플로터 개발 유경험자
 센서 연동 카메라 라이다  딥러닝 모델 포팅  딥러닝 모델 경량화, 관련 분야 석사 학위 이상 소지자 알고리즘 컴퓨터 로봇 등 및 유관 경력 5년 이상  엣지 디바이스 개발 경험 Embedded Linux  센서 연동 경험 카메라 라이다  PyTorch Mobile TensorFlow Lite ONNX NCNN TensorRT 중 최소 1개 이상의 라이브러리를 사용해본 경험제출서류 자율 양식의 이력서   필수 포함내용 성향 및 업무 가치관 개발경험 성공 및 실패 경험협업 or 프로젝트 진행 관련  개발 성과협업 경험을 보여줄 수 있는 포트폴리오 숙련된 프로그래밍 능력 C Shell Python  엣지 디바이스를 사용하여 딥러닝 모델을 포팅하고 추론해본 경험  딥러닝 모델 경량화 경험
