주요 업무,자격요건 및 우대사항
Runway 제품의 백엔드를 개발합니다웹 기반 어플리케이션의 API를 설계하고 구현합니다웹 서비스 제공을 위한 백엔드 시스템을 설계하고 구현합니다,하나 이상의 프로그래밍 언어에 능숙하신 분 Python golang CC 등RDB 와 REST API 서버 설계 및 개발에 대한 지식을 갖추신 분실무 경험을 통해 Kubernetes 에 대한 기본적인 이해가 있는 분MLOps 플랫폼 개발 경험이 있는 분 MLflow argo elastic search kafka 등서비스 인프라  모니터링 구축 및 운영 경험이 있는 분대용량 데이터 처리 기술 NoSQL MapReduce 경험이 있는 분상용 Cloud Platform AWS Azure GCP 사용 경험이 있는 분Agile 한 개발 문화를 경험해보신 분
 레버 엑스퍼트Lever Xpert 레버 엑스퍼트 솔루션 개발 및 운영 FastAPI 백오피스와 광고 운영 도구 개발 및 운영 Django FastAPI 아르고Argo 광고 데이터 ETL 광고 운영 자동화 및 최적화를 위한 비동기 서비스 개발 구글 페이스북 네이버 카카오 등 광고 매체 API 연동 개발 프리즘Prism AWS에서 Data pipeline 및 DL DW DM 구축 배치되는 팀에 따라 위 프로덕트 중 하나를 담당하여 업무를 진행하게 됩니다,에 관심이 많으신 분 책임감이 강한 분 주도적으로 자기 업무를 수행하시는 분 광고 관련 업무 경험 광고 데이터 사용 경험 매체 API 사용 경험 대용량 서비스 개발 및 운영 경험 빅데이터 수집 및 가공 분석 경험 AWS 인프라 구성 및 운영 경험
 레버 엑스퍼트Lever Xpert 레버 엑스퍼트 솔루션 개발 및 운영 FastAPI 백오피스와 광고 운영 도구 개발 및 운영 Django FastAPI 아르고Argo 광고 데이터 ETL 광고 운영 자동화 및 최적화를 위한 비동기 서비스 개발 구글 페이스북 네이버 카카오 등 광고 매체 API 연동 개발 프리즘Prism AWS에서 Data pipeline 및 DL DW DM 구축 배치되는 팀에 따라 위 프로덕트 중 하나를 담당하여 업무를 진행하게 됩니다,에 관심이 많은 분 책임감이 강한 분 주도적으로 자기 업무를 수행하시는 분 커뮤니케이션 능력이 탁월하고 설득력 있게 설명 가능하신 분 광고 업무 이해 Python 기반 서비스 운영 경험 AWS 인프라 구성 및 운영 경험 클라우드 관련 자격증 소지자
Atlassian 및 GitLab 솔루션에 대한 솔루션 엔지니어 역할 입니다솔루션에 대한 설치 구축 기술지원 업무를 수행하게 되며 추후 프로세스 설계자 컨설턴트로 성장하게 됩니다Atlassian 및 GitLab 솔루션에 대한 pipeline 개발자 역할 입니다Atlassian 및 GitLab 솔루션과 타 시스템과의 연계 개발 업무 및 CICD 프로세스를 개발하는 업무를 수행합니다,기본적인 개발 능력 및 경험 IT 프로세스에 대한 이해 등을 갖추고 있으면 도움이 되긴 하지만  가장 중요한 것은 하고자 하는 마음과 의지 입니다컴퓨터 공학 관련 전공자 우대 정보처리기사 자격증 소지자 우대
사전에 학습된 ChatGPT 모델을 의료 도메인 데이터로 미세 조정하여 챗봇 고도화사용자와의 자연스러운 대화를 위한 챗봇 시스템을 설계 및 구현개인맞춤형 건강기능식품 추천을 위한 데이터 전후처리 아키텍쳐 및 알고리듬 고도화 ,경력  13년관련 분야 학사 이상 졸업예정자 포함3년 이상의 SI개발 경력 또는 그에 준하는 역량을 가지신 분대용량 데이터 처리 및 관리에 능숙하신 분 Python Tensorflow Pytorch 등 딥러닝 프레임워크 개발에 능숙하신 분헬스케어 분야에서의 경험이 있으신 분자연어 생성 모델LLM 관련 경험이 있으신 분 Linux Docker 기반 개발 경험하신 분최신 영문 논문을 분석하고 재현하는 데 능숙한 분
 공공  금융 SI 프로젝트 AAApplication Architect 어플리케이션 아키텍트 기술 관리 개발 표준 가이드 및 프레임워크 기술 지원 프로젝트 아키텍트 참여, SI 분야에서 7년 이상의 관련 경력 보유 SI 프로젝트 수행 경험이 있으며 솔루션 설계 가능 DBMS 프로그래밍 언어 등에 대한 이해도가 있는 분 고객 커뮤니케이션 및 협업 능력 팀원들을 지도하고 리드 공공  금융분야 SI 프로젝트 경험자 웹UI 서버 프레임워크 유지관리 경험자 전자정부 Spring 등 유무상 프레임워크 경험자 Cloud 플랫폼 기반 프로젝트 경험자 오픈소스 SW 활용 경험자 마이크로서비스 응용설계 및 구현 경험자
 UXP에서 담당하는 뱅크샐러드의 네이티브 기능 개발을 진행합니다 뱅크샐러드의 주요 제품인 홈 가계부 종알림 화면을 개선하고 새로운 기능을 추가합니다 Push Notification 딥링크 관련 기능을 개선하여 유저가 기능을 빠르고 쉽게 접근할 수 있도록 합니다 개발 생산성 작업을 담당합니다 Web과 Native 간의 interface를 유지보수하여 WebView 기반의 서비스를 안정적으로 운영할 수 있도록 합니다 프로젝트 내 같은 관심사를 갖는 코드의 모듈화 작업을 진행합니다 iOS Chapter 내 코드리뷰에 참여하여 코드 퀄리티 향상에 기여하고 기술 토론을 통해 Best Practice 를 논의하여 개발 생산성을 향상시킵니다 뱅크샐러드 iOS 엔지니어 iOS Engineer는 아래의 , iOS 개발경험이 4년 이상이거나 그에 준하는 실력을 보유하고 있으셔야 합니다 Swift 언어에 대한 높은 이해도를 기반으로 제품을 출시한 경험이 있으셔야 합니다 반응형 프로그래밍 eg RxSwift Combine의 경험이 필요합니다 앱 아키텍처에 대해 고민하고 적용했던 경험이 있으셔야 합니다      MVVM MVP 등의 디자인패턴을 적용해본 경험      공통적으로 쓰이는 코드를 모듈화한 경험 등 Apple Human Interface Guidelines에 대한 이해가 필요합니다 UnitTest 작성 경험이 있으셔야 합니다 다양한 CrashReporting Analytics 도구들을 이용하여 문제를 분석하고 해결할 수 있어야 합니다 Xcode에서 제공하는 View hierarchy Memory graph Debug navigator 등을 이용한 이슈 해결 경험이 있으셔야 합니다 프로젝트에서 필요한 외부 라이브러리를 적절한 요구조건에 맞게 선택하고 검증 및 적용할 수 있어야 합니다 AB 테스팅을 위한 도구사용 및 코드분기 경험이 필요합니다 접근성에 대한 이해가 있는 분을 우대합니다 CICD 설계 및 유지보수 경험이 있는 분을 우대합니다 모듈화 등을 통해 전반적인 프로젝트 관리 및 유지보수성을 높인 경험이 있으면 더욱 좋습니다 10명 이상의 엔지니어와 함께 6개월 이상의 프로젝트에 깊게 참여했던 경험을 우대합니다 Instrument 등을 사용하여 디버깅 난이도가 높은 이슈를 해결한 경험이 있으면 더욱 좋습니다 새로운 기술이나 개발 패러다임에 관심있고 꾸준히 학습하는 분이면 더욱 좋습니다 오픈소스 프로젝트에 기여한 경험을 우대합니다 내 작업물을 문서나 외부 공유용 Readme 블로그 등 으로 기록하고 업데이트 하는 습관을 가지신 분이면 더욱 좋습니다
 메시징 기반 모바일 앱 개발 Lysn 및 디어유 버블 서비스 기능개발 및 유지보수 리팩토링 및 아키텍처 개선, ObjectiveCSwift을 이용한 네이티브 앱 서비스 개발 경력자 Custom UI 및 다양한 디자인은 UIUX 개발 경험자 상용 서비스 개발 및 유지보수 경험자 RESTFUL API에 대한 기본적인 이해를 가지신 분 MVPMVVM 등 디자인 패턴에 대한 이해와 경험 AACAndroid Architecture Components를 통한 개발 경험자 Live StreamingHLS RTSP 등 Client 개발 경험자 오픈소스 분석 및 사용 경험자 메신저 앱 개발 경험자
 메시징 기반 안드로이드 모바일 앱 개발 Lysn 및 디어유버블 서비스 기능개발 및 유지보수 리팩토링 및 아키텍처 개선, KotlinJava를 이용한 Android 앱 서비스 개발 경험자 상용 서비스 개발 및 유지보수 경험자 RESTFUL API에 대한 기본적인 이해를 가지신 분 코드 품질 및 개선에 관심이 많으신 분 MVPMVVM 등 디자인 패턴에 대한 이해와 경험 AACAndroid Architecture Components를 통한 개발 경험자 Live StreamingHLS RTSP 등 Client 개발 경험자 오픈소스 분석 및 사용 경험자
 강남언니 팀 서버 개발자는 이렇게 일해요 배우고 경험하고 성장해요우리는 멈추지 않고 성장하고 싶어요 강남언니 팀은 더 좋은 의료 서비스를 누구나 누릴 수 있게라는 목표를 이루기 위해 시장의 문제를 해결해 왔습니다 이제 그동안보다 더 크고 복잡한 문제를 해결해 나가기 위해 개발자를 비롯한 제품개발 조직 구성원들의 지속적 성장이 반드시 필요하다고 판단하고 있어요 그러기에 강남언니 팀 개발자는 마주한 문제를 해결하는 것만큼이나 해결 과정의 경험과 새로운 지식의 학습을 통해 성장을 이루려 노력해요 미용의료 산업의 복잡한 문제 해결을 엔지니어링해요강남언니 팀이 다루는 많은 문제는 크고 복잡합니다 강남언니 팀 서버 개발자는 의료 서비스 사용자 병원 의사 의료법 개인정보 보호 등 다양한 주체와 이해관계 내에서 균형 있게 비즈니스 문제를 해결하기 위해 다양한 엔지니어링 도구를 사용해요 때로는 신속한 문제 해결에 집중하지만 시스템의 지속성에 멈추지 않고 투자합니다 협업해요강남언니 팀의 그 누구도 혼자서 문제를 해결하지 않아요 강남언니 팀은 높은 수준의 협업을 추구합니다 우리는 극도의 협업을 통해서만 뛰어난 팀이 만들어지며 미용의료 산업의 크고 복잡한 문제를 해결할 수 있다고 믿어요 강남언니 팀 서버 개발자는 동료 서버 개발자 프론트엔드 개발자 디자이너 PO와 긴밀하게 협업해 혼자서는 풀어내기 어려운 문제들을 풀어내고 있어요 엔지니어링 도구의 가치에 집중해요 유행하는 기술 용어에 맹목적으로 따르지 않고 도구의 가치에 집중해 문제 해결에 사용해요 지금 강남언니 팀 서버 개발자는 보다 안정적인 엔지니어링 경험을 확보하기 위해 이런 기법들을 정착시키려 노력하고 있어요 Continuous Integration 단지 Jenkins GitHub Actions 등 CI 지원도구를 사용하는 것과 CI는 달라요 Martin Fowler가 소개한 다음 CI 검증 검사를 만족하는 환경을 가꿔가고 있어요   모든 개발자는 main 브랜치에 최소 매일 한 번 커밋한다  모든 커밋은 자동화된 빌드와 테스트를 실행한다  빌드와 테스트가 실패하면 10분 내에 고쳐진다이런 환경에서 개발하면 그 가치가 더 자주 더 빠르게 사용자에게 전달될 수 있고 개발자는 안정감 위에서 코딩할 수 있게 돼요  테스트 자동화  테스트 자동화는 Continuous Integration Continuous Deployment DevOps 등의 필요 조건이에요 테스트가 높은 수준으로 자동화되어있지 않는 프로세스는 이런 이름으로 부를 수 없습니다 개발자의 많은 작업이 도구에 의해 검증되어 가치 전달에 두려움을 갖지 않도록 자동화된 테스트 케이스를 늘리고 테스트 주도 개발testdriven development을 적용하고 시스템과 프로세스를 개선하고 있어요 짝 프로그래밍Pair Programming 단체 프로그래밍Mob Programming 코드 리뷰 코딩은 협업입니다 모든 강남언니 팀 개발자는 혼자만의 판단으로 main 브랜치에 커밋할 수 없도록 권한이 제한되어 있어요 모든 코드는 짝 프로그래밍을 통해 작성되거나 동료의 리뷰를 거친 승인을 받아야만 pull request를 통해 main 브랜치에 추가될 수 있어요 때론 같은 비즈니스 요구사항을 다루는 서버 웹 프론트엔드 모바일 개발자가 함께 모여 코드를 쓰기도 해요 도메인 주도 설계DomainDriven Design 강남언니 팀도 미용의료 산업도 빠르게 변화하고 확장되고 있어요 이런 변화에 대한 시스템의 적응력은 노력 없이 주어지지 않아요 시스템이 비즈니스 환경에 적응하지 못하면 서비스도 조직도 비전도 물거품이 됩니다 유연한 아키텍처를 확보하기 위해 여러가지 설계 기법을 학습하고 적용해야 해요강남언니 팀은 도메인 주도 설계를 서버 시스템 확장에 기반이 되는 기법으로 정착시키고 있어요 전술 기법에만 매몰되면 작은 엔지니어링 재미는 느낄지언정 개발자의 시야가 좁아지고 도메인 주도 설계의 가치를 취하지 못합니다 그래서 우리는 전술적 패턴 뿐 아니라 유비쿼터스 언어와 전략적 설계에도 집중해 도메인의 문제를 효율적으로 풀어내고 아키텍처 지속성을 확보하려 노력해요 이벤트 기반 아키텍처EventDriven Architecture Microservices 패턴이 유행하고 있지만 단지 모듈 관계에 HTTP 요청을 적용하는 것만으론 해결되는 문제보다 유발되는 문제가 더 많아질 수 있어요 강남언니 팀 개발자는 도메인 주도 설계에 기반해 시스템 내 경계를 설정하고 분리된 요소들이 비동기 이벤트를 사용해 유연하게 통합되도록 아키텍처를 설계해요 우리는 이런 도구를 사용해요강남언니 팀 서버 개발자는 다음의 도구를 주로 사용해요 그 밖에도 주어진 문제에 따라 가장 적합한 여러가지 도구를 도입합니다 개발 언어  Java Kotlin 프레임워크  Spring Boot JPA Hibernate 데이터베이스  MySQL MongoDB Elasticsearch 인프라  AWS Kubernetes, 5년차 이상 또는 그에 준하는 실력을 갖춘 분 웹 서버 엔지니어링 경험과 역량을 갖춘 분 하나 이상의 OOObjectOriented 프로그래밍 언어를 능숙하게 다루는 분 문제의 본질을 이해하고 답을 찾기 위해 동료의 의견에 집중하는 분 자신의 생각을 말 글 그림을 통해 합리적으로 표현할 수 있는 분 문제 해결에 필요하다면 자신의 지식과 경험을 내려놓을 수 있는 분 지금보다 더 나은 엔지니어로 성장하고 싶은  모듈화에 대한 설계 원칙들의 개념과 장단점을 이해하는 분 서버 시스템 아키텍처 설계 패턴들의 개념과 장단점을 이해하는 분 HTTP API의 장단점을 이해하는 분 전통적 아키텍처와 클라우드 아키텍처의 차이를 이해하는 분 CQRSCommand Query Responsibility Segregation를 이해하는 분 2년 이상의 NoSQL 데이터베이스 운영 경험을 가진 분 테스트 주도 개발 이해와 경험을 가진 분 1년 이상의 Continuous Integration과 Continuous Deployment 운영 경험을 가진 분
 병원의 운영 체계부터 고객 관리까지 담당하는 제품의 백엔드를 개발해요 새로운 비즈니스를 시작하는 작은 팀에서 하나의 제품에 몰입하고 고객에게 가치를 전달해요 미용 의료 병원의 도메인과 비즈니스 문제들을 이해하고 이를 해결하는 제품을 개발해요 병원 운영자가 실시간으로 접수를 받고 시술을 실행하고 필요한 안내를 하기 위한 제품을 개발해요 병원 방문자가 예약을 하고 병원을 방문하고 시술을 받고 귀가하는 과정에 필요한 제품을 개발해요 API 개발을 넘어서 소프트웨어와 데이터 아키텍처를 고민하며 지속적인 확장에 용이한 제품을 개발해요강남언니팀의 서버 개발자는 이렇게 일합니다Continuous Integration단지 Jenkins GitHub Actions 등 CI 지원도구를 사용하는 것과 CI는 다릅니다 Martin Fowler가 소개한 다음 CI 검증 검사를 만족하는 환경을 가꿔가고 있습니다 모든 개발자는 main 브랜치에 최소 매일 한 번 커밋한다 모든 커밋은 자동화된 빌드와 테스트를 실행한다 빌드와 테스트가 실패하면 10분 내에 고쳐진다이런 환경에서 개발자가 만든 가치는 좀 더 자주 빠르게 사용자에게 전달되고 개발자는 안정감 위에서 코딩할 수 있습니다테스트 자동화테스트 자동화는 Continuous Integration Continuous Deployment DevOps 등의 필요조건입니다 테스트가 높은 수준으로 자동화 되어있지 않는 프로세스는 이런 이름으로 부를 수 없습니다 개발자의 많은 작업들이 도구에 의해 검증되어 가치 전달에 두려움을 갖지 않도록 자동화 된 테스트 케이스를 늘리고 테스트 주도 개발testdriven development을 적용하고 시스템과 프로세스를 개선하고 있습니다도메인 주도 설계DomainDriven Design강남언니도 미용의료 산업도 빠르게 변화하고 확장되고 있습니다 이런 변화에 대한 시스템의 적응력은 노력 없이 주어지지 않습니다 시스템이 비즈니스 환경에 적응하지 못하면 서비스도 조직도 비전도 물거품이 됩니다 강남언니 서버 개발자는 유연한 아키텍처를 확보하기 위해 여러가지 설계 기법을 학습하고 적용합니다강남언니는 도메인 주도 설계를 서버 시스템 확장에 기반이 되는 기법으로 정착시키고 있습니다 전술 기법에만 매몰되면 작은 엔지니어링 재미는 느낄지 언정 개발자의 시야가 좁아지고 도메인 주도 설계의 가치를 취하지 못합니다 그래서 우리는 전술적 패턴 뿐 아니라 유비쿼터스 언어와 전략적 설계에도 집중해 도메인의 문제를 효율적으로 풀어내고 아키텍처 지속성을 확보하려 노력합니다이벤트 기반 아키텍처EventDriven ArchitectureMicroservices 패턴이 유행하고 있지만 단지 모듈 관계에 HTTP 요청을 적용하는 것만으론 해결되는 문제보다 유발되는 문제가 더 많아질 수 있습니다 강남언니 서버 개발자는 도메인 주도 설계에 기반 해 시스템 내 경계를 설정하고 분리된 요소들이 비동기 이벤트를 사용해 유연하게 통합되도록 아키텍처를 설계합니다강남언니는 서버 개발자는 이런 도구를 사용합니다강남언니 서버 개발자는 다음의 도구를 주로 사용합니다그 밖에도 주어진 문제에 따라 가장 적합한 여러가지 도구를 도입합니다프로그래밍 언어 Java Kotlin Typescript프레임워크 Spring Boot Spring Webflux Nodejs데이터베이스 MongoDB MySQL인프라 AWS Kubernetes, 웹 서버 엔지니어링 경험과 역량을 갖춘 분 하나 이상의 OOObjectOriented 프로그래밍 언어를 능숙하게 다루는 분 문제의 본질을 이해하고 답을 찾기 위해 동료의 의견에 집중하는 분 자신의 생각을 말 글 그림을 통해 합리적으로 표현할 수 있는 분 문제 해결에 필요하다면 자신의 지식과 경험을 내려놓을 수 있는 분 지금보다 더 나은 엔지니어로 성장하고 싶은 분다음 역량은 서버 프로그래머로 저희와 함께 하기 위해 반드시 필요하지는 않지만 제품개발 조직의 역량을 더욱 높여줄 수 있다고 믿기에 높이 평가합니다 DDDDomain Driven Design에 대한 이해도가 높은분 MSA와 분산 서버 시스템 운영 경험이 있으신 분 AWS 인프라 사용 경험이 풍부하신 분 글로벌 제품 혹은 SaaS 애플리케이션 운영 경험을 가진 분 서버 시스템의 클린 아키텍처 설계 패턴에 대한 이해도가 높은 분 이벤트 소싱과 CQRSCommand Query Responsibility Segregation를 이해하는 분 테스트 주도 개발 이해와 경험을 가진 분 일을 더 작고 빠르고 자동적으로 되게 만드는 것에 빠져있는 분
 사용자 모델 UIUX에 대한 개념을 포함한 을 고려한 SDK 아키텍처 개발 리드 각 컴포넌트 수준으로 개발된 SW code를 일체화된 블록화를 통한 SDK로의 통합 리드 여러 팀 및 각 SW 컴포넌트 개발자와 효과적으로 소통 하여 SDK 개발 목표 설정 목표된 SDK의 개발 목표에 부합하는 SW 컴포넌트 아키텍처 설계 리드 SW 구성 요소 인터페이스의 사양을 개발 리드 API를 개발하여 SW 구성 요소 간 일관된 아키텍처 및 인터페이스 구현 리드 교차 구성 요소의 workflow 자동화 리드 릴리스 패키지 관리 도구를 개발 리드, 정확한 의사 소통을 통한 근거 기반 업무 추진이 가능한 합리적인 직무 능력 컴퓨터 공학 및 관련 학사 학위 이상 최소 5년 이상의 그룹단위 이상의 개발자들과 효과적으로 소통하며 전문 소프트웨어 실무 개발해 본 경험 최소 2년의 전문적인 Python 개발 경험 및 기술 보유 제품 또는 시스템 수준에서 API를 개발한 경험 및 Python 도구 및 라이브러리 패키징 경험 패키징 옵션에 대한 지식 보유 임베디드 SW 및 플랫폼 기반 소프트웨어 개발 경험 linux특히 Ubuntu에서 패키지 배포 경험 C 개발 경험 특히 C14 이상 DevOps 또는 릴리스 엔지니어링 경험 도커 경험 머신딥 러닝에 대한 이해
 기술 지원 고객사 관리 빅데이터 인프라 설계구축 오픈소스 리서치  아키텍처 테스트 운영체계Linux OS 관리튜닝 프로젝트 수행 구축 시스템 유지보수, 경력  관련 경력 3년   LinuxUNIX 시스템에 대한 지식 운영체제 배경 지식 분산 환경에 대한 지식 네트워크아키텍처 데이터통신 기본 지식 오픈소스 도입  사용 경험 Container 환경에 대한 지식 구축형Saas Paas 시스템 경험 고객사 시스템 유지보수 경험자 우대 고객사 방문 장애 대응 경험자 우대 shell python 등 서버 관리용 스크립트 작성 가능 ansible chef Puppet과 같은 클러스터 오케스트레이션 도구 활용 경험 Hadoop 및 Hadoop Eco 활용 가능 hdfs Spark Hive Presto ZookeeperYarn 등 프로그래밍 개발 경험 Java Python 등 Technical architect 수행 경력 보유 Linux container 기반의 시스템 구축 운영 경험또는 가능자 Ceph 분산 스토리지 구축 운영 경험또는 가능자 IT 인프라 모니터링에 대한 지식 보유 Kubernetes operator 구축운영 경험 또는 가능자
담당하게 될 업무입니다 SwiftMR 의 Global 한 서비스를 위해 대규모 SaaS 서비스 아키텍쳐를 설계하고 개선 담당 Scalable 한 운영을 위한 관련 서버 및 서비스 개발 담당 Licensing Billing 서비스 개발 담당 에어스메디컬 백엔드 개발 스택    Golang Gin Chi NestJS Typscript Python RestAPI GraphQL Hasura PostgreSQL RabbitMQ    AWS EKS k8s Gitlab ArgoCD,업무 수행에 필요한 자질입니다 백엔드 실무경력 5년 이상 혹은 이에 준하는 실력을 갖추신 분 SaaS 서비스 아키텍쳐를 설계를 주도하거나 참여한 경험이 있으신 분 Billing 과 라이센싱 관련 서비스 개발 경험이 있으신 분이런 분이면 더욱 좋습니다 MSA 에 대한 이해도가 있으신 분 효율적이고 지속가능한 개발 방식과 개발 방법문화 정착에 관심 있으신 분 주도적으로 개발을 리드해본 경험이 있거나 해보고 싶으신 분
 라이드 헤일링 서비스 TADA의 백엔드 유지 보수 및 신기능 개발 SOLID 원칙을 비롯한 Clean Code standard를 지키는 코드를 작성하고 유지보수  Architectural best practices를 연구하여 적용 안정적이고 빠른 코드 작성 협업이 가능한 코드를 위한 코드 리뷰 및 효율적인 코드를 위한 리팩토링 작업업무내용 라이드 헤일링 서비스 TADA의 백엔드 유지 보수 및 신기능 개발, Kotlin에 대한 기본적인 이해 및 경험 우대 Database 통신을 사용한 기본적인 백엔드 서버 제작 능력 기본적인 비즈니스 로직 구성 능력 스프링 프레임워크 사용 경험 API를 활용한 Frontend 개발자와의 소통 능력 3년 혹은 그에 준하는 경험자 Microservice Architecture에 대한 활용이 능숙하신 분 AMQP gRPC 등 서비스 간 통신에 대해 잘 이해하고 계시는 분 Docker k8s 등 가상화 솔루션에 대한 이해를 잘 하고 계시는 분 AxonIQ 등의 event driven 프레임워크의 활용이 능숙하신 분 Global 서비스 개발 경험이 있으신 분 영어로 의사소통이 가능하신 분
1 루티너리에 최적화 된 ReactNative를 개발합니다2 디자인 시스템의 RN 라이브러리를 개발합니다3 루티너리의 배포를 관리합니다,  좋은 제품을 만드는 데에 욕심과 열망이 있으신 분  모바일 어플리케이션 개발 경력 3년 이상인 분  프로덕션 레벨에서 RN 네이티브 모듈을 직접 만들어 사용한 경험이 있는 분  ReactNative 상태관리 도구 MobX reactquery 등에 능숙한 분  요구사항에 맞게 로직을 설계하고 운영할 수 있는 분  모듈화 테스트 유지보수가 용이한 코드를 이해하고 적용할 수 있는 분  앱 배포 CICD 구축 경험  네이티브 앱 개발 경험  디톡스 TDD 기반 개발 경험  CodePush 등을 이용한 배포를 관리 경험  애자일과 스크럼에 대한 이해
