주요 업무,자격요건 및 우대사항
강남언니 팀 웹 프론트엔드 개발자는 이렇게 일해요 배우고 경험하고 성장해요 우리는 멈추지 않고 성장하고 싶어요 강남언니 팀은 더 좋은 의료 서비스를 누구나 누릴 수 있게라는 목표를 이루기 위해 시장의 문제를 해결해 왔습니다 이제 그동안보다 더 크고 복잡한 문제를 해결해 나가기 위해 개발자를 비롯한 제품개발 조직 구성원들의 지속적 성장이 반드시 필요하다고 판단하고 있어요 그러기에 강남언니 팀 개발자는 마주한 문제를 해결하는 것 만큼이나 해결 과정의 경험과 새로운 지식의 학습을 통해 성장을 이루려 노력해요 미용의료 산업의 복잡한 문제 해결을 엔지니어링해요 강남언니 팀이 다루는 많은 문제는 크고 복잡합니다 강남언니 팀 웹 프론트엔드 개발자는 의료 서비스 사용자 병원 의사 의료법 개인정보 보호 등 다양한 주체와 이해관계 내에서 균형있게 비즈니스 문제를 해결하기 위해 다양한 엔지니어링 도구를 사용해요 때로는 신속한 문제 해결에 집중하지만 시스템의 지속성에 멈추지 않고 투자합니다 협업해요 강남언니 팀의 그 누구도 혼자서 문제를 해결하지 않아요 강남언니 팀은 높은 수준의 협업을 추구합니다 우리는 극도의 협업을 통해서만 뛰어난 팀이 만들어지며 미용의료 산업의 크고 복잡한 문제를 해결할 수 있다고 믿어요 강남언니 팀 웹 프론트엔드 개발자는 동료 프론트엔드 개발자 서버 개발자 디자이너 PO와 긴밀하게 협업해 혼자서는 풀어내기 어려운 문제들을 풀어내고 있어요 엔지니어링 도구의 가치에 집중해요 유행하는 기술 용어에 맹목적으로 따르지 않고 도구의 가치에 집중해 문제 해결에 사용해요 지금 강남언니 팀 개발자는 보다 안정적인 엔지니어링 경험을 확보하기 위해 이런 기법들을 정착시키려 노력하고 있어요 Continuous Integration 단지 Jenkins GitHub Actions 등 CI 지원도구를 사용하는 것과 CI는 달라요 Martin Fowler가 소개한 다음 CI 검증 검사를 만족하는 환경을 가꿔가고 있어요  모든 개발자는 main 브랜치에 최소 매일 한 번 커밋한다 모든 커밋은 자동화된 빌드와 테스트를 실행한다 빌드와 테스트가 실패하면 10분 내에 고쳐진다이런 환경에서 개발하면 그 가치가 더 자주 더 빠르게 사용자에게 전달될 수 있고 개발자는 안정감 위에서 코딩할 수 있게 돼요  테스트 자동화  테스트 자동화는 Continuous Integration Continuous Deployment DevOps 등의 필요조건이에요 테스트가 높은 수준으로 자동화 되어있지 않는 프로세스는 이런 이름으로 부를 수 없습니다 개발자의 많은 작업들이 도구에 의해 검증되어 가치 전달에 두려움을 갖지 않도록 자동화 된 테스트 케이스를 늘이고 테스트 주도 개발testdriven development을 적용하고 시스템과 프로세스를 개선하고 있어요 짝 프로그래밍Pair Programming 단체 프로그래밍Mob Programming 코드 리뷰 코딩은 협업입니다 모든 강남언니 팀 개발자는 혼자만의 판단으로 main 브랜치에 커밋할 수 없도록 권한이 제한되어 있어요 모든 코드는 짝 프로그래밍을 통해 작성되거나 동료의 리뷰를 거친 승인을 받아야만 pull request를 통해 main 브랜치에 추가될 수 있어요 때론 같은 비즈니스 요구사항을 다루는 서버 웹 프론트엔드 모바일 개발자가 함께 모여 코드를 쓰기도 해요 도메인 주도 설계DomainDriven Design 강남언니 팀도 미용의료 산업도 빠르게 변화하고 확장되고 있어요 이런 변화에 대한 시스템의 적응력은 노력 없이 주어지지 않아요 시스템이 비즈니스 환경에 적응하지 못하면 서비스도 조직도 비전도 물거품이 됩니다 유연한 아키텍처를 확보하기 위해 여러가지 설계 기법을 학습하고 적용해야 해요강남언니 팀은 도메인 주도 설계를 서버 시스템 확장에 기반이 되는 기법으로 정착시키고 있어요 전술 기법에만 매몰되면 작은 엔지니어링 재미는 느낄지언정 개발자의 시야가 좁아지고 도메인 주도 설계의 가치를 취하지 못합니다 그래서 우리는 전술적 패턴 뿐 아니라 유비쿼터스 언어와 전략적 설계에도 집중해 도메인의 문제를 효율적으로 풀어내고 아키텍처 지속성을 확보하려 노력해요우리는 이런 도구를 사용해요강남언니 팀 웹 프론트엔드 개발자는 다음의 도구를 주로 사용해요 그 밖에도 주어진 문제에 따라 가장 적합한 여러가지 도구를 도입합니다 개발 언어  JavaScriptTypeScript 프레임워크  ReactNextjs VueNuxtjs Monorepo Turborepo Nodejs 인프라  AWS Kubernetes,이런 분을 모시고 싶어요 모던 웹 개발React Vue 등 경험이나 그에 준하는 역량을 갖춘 분 Semantic Markup 및 Sass Stylus 등 CSS 전처리기를 활용한 개발에 능숙하신 분 문제의 본질을 이해하고 답을 찾기 위해 동료의 의견에 집중하는 분 자신의 생각을 말 글 그림을 통해 합리적으로 표현할 수 있는 분 문제 해결에 필요하다면 자신의 지식과 경험을 내려놓을 수 있는 분 지금보다 더 나은 엔지니어로 성장하고 싶은 분이런 점이 있다면 더욱 좋아요 모바일 앱 내 웹뷰 개발 경험을 가진 분 좋은 아키텍처의 생산성 기여를 깊이 이해하시는 분 디자인 시스템 도입 등 팀 개발 효율을 높인 경험을 가진 분 모듈화에 대한 설계 원칙들의 개념과 장단점을 이해하는 분 테스트 주도 개발 이해와 경험을 가진 분 1년 이상의 Continuous Integration과 Continuous Deployment 운영 경험을 가진 분
 병원의 운영 체계부터 고객 관리까지 담당하는 제품의 백엔드를 개발해요 새로운 비즈니스를 시작하는 작은 팀에서 하나의 제품에 몰입하고 고객에게 가치를 전달해요 미용 의료 병원의 도메인과 비즈니스 문제들을 이해하고 이를 해결하는 제품을 개발해요 병원 운영자가 실시간으로 접수를 받고 시술을 실행하고 필요한 안내를 하기 위한 제품을 개발해요 병원 방문자가 예약을 하고 병원을 방문하고 시술을 받고 귀가하는 과정에 필요한 제품을 개발해요 API 개발을 넘어서 소프트웨어와 데이터 아키텍처를 고민하며 지속적인 확장에 용이한 제품을 개발해요강남언니팀의 서버 개발자는 이렇게 일합니다Continuous Integration단지 Jenkins GitHub Actions 등 CI 지원도구를 사용하는 것과 CI는 다릅니다 Martin Fowler가 소개한 다음 CI 검증 검사를 만족하는 환경을 가꿔가고 있습니다 모든 개발자는 main 브랜치에 최소 매일 한 번 커밋한다 모든 커밋은 자동화된 빌드와 테스트를 실행한다 빌드와 테스트가 실패하면 10분 내에 고쳐진다이런 환경에서 개발자가 만든 가치는 좀 더 자주 빠르게 사용자에게 전달되고 개발자는 안정감 위에서 코딩할 수 있습니다테스트 자동화테스트 자동화는 Continuous Integration Continuous Deployment DevOps 등의 필요조건입니다 테스트가 높은 수준으로 자동화 되어있지 않는 프로세스는 이런 이름으로 부를 수 없습니다 개발자의 많은 작업들이 도구에 의해 검증되어 가치 전달에 두려움을 갖지 않도록 자동화 된 테스트 케이스를 늘리고 테스트 주도 개발testdriven development을 적용하고 시스템과 프로세스를 개선하고 있습니다도메인 주도 설계DomainDriven Design강남언니도 미용의료 산업도 빠르게 변화하고 확장되고 있습니다 이런 변화에 대한 시스템의 적응력은 노력 없이 주어지지 않습니다 시스템이 비즈니스 환경에 적응하지 못하면 서비스도 조직도 비전도 물거품이 됩니다 강남언니 서버 개발자는 유연한 아키텍처를 확보하기 위해 여러가지 설계 기법을 학습하고 적용합니다강남언니는 도메인 주도 설계를 서버 시스템 확장에 기반이 되는 기법으로 정착시키고 있습니다 전술 기법에만 매몰되면 작은 엔지니어링 재미는 느낄지 언정 개발자의 시야가 좁아지고 도메인 주도 설계의 가치를 취하지 못합니다 그래서 우리는 전술적 패턴 뿐 아니라 유비쿼터스 언어와 전략적 설계에도 집중해 도메인의 문제를 효율적으로 풀어내고 아키텍처 지속성을 확보하려 노력합니다이벤트 기반 아키텍처EventDriven ArchitectureMicroservices 패턴이 유행하고 있지만 단지 모듈 관계에 HTTP 요청을 적용하는 것만으론 해결되는 문제보다 유발되는 문제가 더 많아질 수 있습니다 강남언니 서버 개발자는 도메인 주도 설계에 기반 해 시스템 내 경계를 설정하고 분리된 요소들이 비동기 이벤트를 사용해 유연하게 통합되도록 아키텍처를 설계합니다강남언니는 서버 개발자는 이런 도구를 사용합니다강남언니 서버 개발자는 다음의 도구를 주로 사용합니다그 밖에도 주어진 문제에 따라 가장 적합한 여러가지 도구를 도입합니다프로그래밍 언어 Java Kotlin Typescript프레임워크 Spring Boot Spring Webflux Nodejs데이터베이스 MongoDB MySQL인프라 AWS Kubernetes, 웹 서버 엔지니어링 경험과 역량을 갖춘 분 하나 이상의 OOObjectOriented 프로그래밍 언어를 능숙하게 다루는 분 문제의 본질을 이해하고 답을 찾기 위해 동료의 의견에 집중하는 분 자신의 생각을 말 글 그림을 통해 합리적으로 표현할 수 있는 분 문제 해결에 필요하다면 자신의 지식과 경험을 내려놓을 수 있는 분 지금보다 더 나은 엔지니어로 성장하고 싶은 분다음 역량은 서버 프로그래머로 저희와 함께 하기 위해 반드시 필요하지는 않지만 제품개발 조직의 역량을 더욱 높여줄 수 있다고 믿기에 높이 평가합니다 DDDDomain Driven Design에 대한 이해도가 높은분 MSA와 분산 서버 시스템 운영 경험이 있으신 분 AWS 인프라 사용 경험이 풍부하신 분 글로벌 제품 혹은 SaaS 애플리케이션 운영 경험을 가진 분 서버 시스템의 클린 아키텍처 설계 패턴에 대한 이해도가 높은 분 이벤트 소싱과 CQRSCommand Query Responsibility Segregation를 이해하는 분 테스트 주도 개발 이해와 경험을 가진 분 일을 더 작고 빠르고 자동적으로 되게 만드는 것에 빠져있는 분
자사 보유중인 솔루션에 대한 공공 프로젝트 SI 개발 및 유지 보수인프라 네트워크 구성 및 관리 업무SI 테스트 문제해결 및 모니터링프로젝트 일정을 준수하고 협력적으로 팀원과 소통 업무 ,학력 초대졸 이상경력 4년 이상스킬 Spring Spring Boot모집인원 00명SI 프로젝트 유경험자DBMS 및 SQL 능숙하신 분 Restful API설계 및 개발 업무 유경험자웹 서비스 개발 구축 업무 유경험자
 레어데이터 Fullstack Engineer은 주로 이런 일을 담당해요 임상연구 솔루션의 클라이언트 서버 신규기능 개발 및 고도화 기존 시스템의 취약점을 파악하여 개선 기획자 디자이너와 협력하여 제품 기획 구체화, 이런 휴먼이라면 시너지를 낼 수 있어요 2년 이상의 NodeJS 경험이 있으신 분 1년 이상의 Typescript 경험이 있으신 분 1년 이상의 React 경험이 있으신 분 MongoDB 경험이 있으신 분 NestJS 경험이 있으신 분 reactquery 활용 경험이 있으신 분 AWS 사용 경험이 있으신 분
 ROS 기반 로봇 앱 개발 Flutter 기반의 Android 앱 서비스, 학사 이상 Android App 개발 경력 5년 이상 Flutter를 활용한 Android 개발 경력 3년 이상 NOSQL HIVE 활용가능자경험자 FlutterBlue 를 이용한 블루투스 사용 경험자 팀 단위에서 Git 사용 경험 보유하신 분 Android 프레임웍에 대한 높은 이해도를 보유하신 분 책임감을 가지고 주도적으로 업무 수행이 가능하신 분 긍정적인 마인드와 원할한 커뮤니케이션 능력으로 협업 마인드를 갖추신 분
 업무 자사 서비스Onfit Selvy Checkup 개발, Java 기반 Web Application 개발 경험 5년 이상 보유하신 분 Springframeworkspring springboot 개발 경험 및 이해가 가능하신 분 RDBMSMySQL Oracle MSSQL등 연동 개발이 가능하신 분 RESTful API 경험자을 보유하신 분 클린코드와 리팩토링에 관심이 있으신분 Front Frameworkvuejs reactjs 경험하신 분 AWS 서비스 연동을 경험AWS인프라 구축 및 배포경험하신 분 PL을 경험하신 분 PM업무 수행 경력이 있거나 수행이 가능하신 분
 리디북스 및 리디셀렉트 백엔드 서비스 개발 플랫폼 내 백오피스 서비스 개발, 백엔드 개발 경력 3년 이상 또는 그에 준하는 경험을 가지신 분 AWS Nodejs Typescript MySQL 기반 웹 어플리케이션 개발이 가능하신 분 웹 프로토콜 및 인프라에 대한 이해를 갖추신 분 대용량 트래픽을 위한 설계 및 구현에 대한 이해를 갖추신 분 웹툰 게임 등의 콘텐츠 서비스에 경험이나 관심이 있으신 분 당장의 해결도 중요하지만 보다 근본적인 문제에 대해 고민하시는 분 이전 보다 더 나은 결과물을 위해 고민하시는 분 동료를 신뢰하고 신뢰받을 수 있는 분
 AWS를 통해 laaS 모델의 서버 운영 유저 서비스에서 사용되는 다양한 API 개발 및 관리 백엔드 아키텍쳐 설계 및 개선, 컴퓨터 및 소프트웨어 공학 학사 이상 Nodejs  Python 언어 사용 가능하신 분 APIREST GraphQL 설계 및 최적화 가능하신 분 클라우드 환경에 대한 이해가 있으신 분 Database design에 대한 이해가 있으신 분 AWS에 대한 경험이 있으신 분 Computer Science 지식에 대한 깊은 이해가 있는 분 오픈소스 개발 경험이 있으신 분 다양한 Database에 대한 이해를 바탕으로 용도에 맞는 최적의 DB 선택 및 설계가 가능하신 분
시스템 구축을 기반한 업무 프로세스 개선 및 시스템 기획설계운영현장 업무 환경 및 프로세스 분석을 통한 개선안 도출 효율화표준화최적화고객 서비스 프로세스 여행렌터카 기획 및 고도화내부 임직원 또는 외부 고객의 시스템 요구 사항에 대한 업무 프로세스 작성,경력  3년 이상시스템 PI관련 업무 또는 개발 경력대내외 고객 및 개발 직군과의 원활한 의사소통 능력 보유자사내외 컨설팅 유경험자프론트백엔드 웹 서비스 개발 및 운영 유경험자
지능형 솔루션 백엔드 시스템 개발분석서버관리 데이터 저장관리    NodeJSTypescript RestAPI WebSocket MariaDB      현재 NodeJS로 되어 있으나 향후 개발 언어 변경 가능스킬현재 기준  NodeJSTypescript MariaDB REST API WebSocket,컴퓨터 관련 학과37년 경력개발자핵삼역량성실성 윤리의식 성장지향성 계획성 적응성 창의성 협동심공통역량언어 및 프레임워크 전환에 열려 있는 분소통 및 의사 전달에 문제 없는 분DB 스키마 설계 및 쿼리 작성 경험자대용량 처리Web Frontend React 간단 개발 경험자
Vurix자사 영상관제 솔루션 Server 새 기능 개발 및 결함 관리미디어 녹화 및 스트리밍 서비스카메라와 Vurix Server간 Interface driver 개발AI 카메라 기능 연동 개발Vurix와 3rd party 시스템 인터페이스Rest Full API 서버 개발수 만대 이상의 카메라 데이터 관리자산 및 이벤트 등,25년차 1명 6년차 이상 1명C 개발 경험이 각각 2년 6년이상 있으신 분DB 연동 경험이 있으신 분효과적인 의사전달 및 협업 능력이 있으신 분논리적이고 체계적인 문제해결 능력이 있으신 분ONVIF profile 개발 경험이 있으신 분Boost asio 개발 경험이 있으신 분RTSP  HLS  ffmpeg 개발 경험이 있으신 분Linux 시스템 숙련자Nodejs 개발 경험이 있으신 분Agile 개발 문화 경험 및 TDD 방법론 경험이 있으신 분
Web 백엔드 서비스 개발 관련 업무 수행TMSrealTime Management System 플랫폼 서비스 웹백엔드 개발업무 수행,대졸학사이상경력 5년이상팀장 경험자2년 이상웹 어플리케이션 개발 유경험자Go Lang 개발 경험자 또는 관심자Linux 환경에서 개발 및 서버 운영 경험현장 업무 추진출장 등이 가능한 자컨테이너기반 MSA기반 서비스 경험자오픈소스 소프트웨어 활용 경험
 React를 기반 이용한 신규 웹앱 개발 CMS Content Management System 기반의 비즈니스 플랫폼 개발,3년 이상 React 기반 웹앱 개발 경험 또는 상응하는 모바일 앱 개발 경험이 있는 분외부 라이브러리 API 등 연동 개발 경험을 보유하신 분Git을 통한 형상관리 및 Slack Notion 등 협업 도구 기반으로 유관부서 및 동료와 커뮤니케이션이 원활한 분자료구조 알고리즘 디자인 패턴 등에 대한 기본 개념을 이해하는 분앱 배포 경험이 있는 분테스트 자동화 및 테스트 코드 작성 경험이 있는 분iOSAndroid 네이티브 앱 개발 경험이 있는 분Apollo GraphQL 경험이 있는 분비디오오디오 처리 관련 지식 및 기술을 보유하고 있는 분사용자 경험을 개선하는데 필요한 퍼포먼스 개선 및 네트워킹 구현 경험이 있는 분Full stack 개발 경험이 있는 분
 개발팀 조직과 함께 고객사 프로젝트 수행 및 내부 RD 대학과 함께하는 Location기반의 연구사업 수행 공공 민간 기업의 위치기반 상권분석등 다양한 프로젝트 수행, 7년 이상의 개발경력 또는 그에 준하는 경험을 갖추신 분 AWS GCP등 Public Cloud 환경에서 개발프로젝트 리딩 경험자 Angular React Vuejs 등 1개 이상의 FrontEnd Framework 사용에 능숙하신 분 Spring Spring boot를 이용한 서버 개발 경험 RESTful API 연동을 통해 SPA 운영개발에 경험 있으신 분 PostgreSQL MySQL 등의 RDBMS 사용 경험 및 모델링 가능하신 분 아키텍쳐 설계 및 제안 코드리뷰 테스트 등 품질향상을 위해 적극적인 분 팀 단위 협업과 프로젝트 제안 분석설계 및 프로젝트 리딩개발이 가능한 분 GIS 엔진을 이용하여 개발을 경험해 보신 분 Cesium 이용하여 개발을 경험해 보신 분 새로운 것의 학습에 대해 거부감이 없으신 분
 통신사 PASS앱 본인인증 이력 기반 서비스 프론트엔드 개발운영 업무    서비스 활성화를 위한 외부채널 광고 페이지 개발 및 유지보수 포함  Vuejs 기반의 SPA 서비스 페이지 및 어드민CMSCRM 유지보수 회사 홈페이지 개발 및 유지보수 신규 서비스 설계 및 개발, Vuejs 또는 Nuxtjs를 활용한 프론트엔드 개발 실무 경험을 보유하신 분 2년 이상 HTML CSSSCSS Javascript 사용에 능숙하신 분 RESTfull API 등 통신을 통한 실무 경험을 보유하신 분 웹표준 웹접근성에 대한 이해도를 보유하신 분 개발부터 서버 배포까지 전체 개발 프로세스에 대한 경험이 있으신 분 Slack Jira Confluence FIGMA 등의 협업 Tool을 활용 경험 RestFul API에 대한 이해가 높으신 분 AOSIOS 네이티브 앱개발 경험이 있으신 분이력서 내용 중 주목하는 부분을 말씀드릴게요 프로젝트 수행 이력 및 사용 기술 스텍 프로젝트 소개 담당한 부분 적용 기술 기여도 및 문제점 회고 본인의 장단점을 확인할 수 있는 경험사례성격 기술 커뮤니케이션 방식 등
 MSA 서비스 구현  공통 개발 설계 분석   java spring boot를 활용한 다양한 개발    message 기반 서비스 이해    github svn    REST API 설계 경험    eclipse maven    harbor argocd 사용    elasticsearch kafka, JAVA 혹은 개발 경력 7년 이상인 분 Spring framework Spring Boot 이해도가 높으신 분 CICD를 통한 빌드 테스트 배포 자동화에 대한 환경을 이해하시는 분 손해 생명 보험 도메인 경험자 다양한 Open Source 경험 Middleware 경험이 다양한 분 주어진 문제에 주체적이신 분
 솔루션 개발 및 구축 검색 추천 챗봇 솔루션 구축 프로젝트 수행, 경력 3년 이상 JAVA 및 Spring 기반 웹 개발 가능한 분 Nodejs 개발 가능한 분 ELK 스택 오픈소스에 조예가 있는 분 정보처리기사 또는 SCJP등 자격증 보유한 분
업무분석  설계개발  유지보수PL 수행 가능 주요스킬Java SpringbootVuejs20 이상MySQL Oracle,고용형태  경력 정규직경력사항   7년 이상 중급고급 학력  대졸23년이상 관련학과 전공자    전산학컴퓨터공학응용소프트웨어공학정보통신공학  해당 직무 근무 경험자   성실하고 책임감 있는 분 업무 분석 및 설계 가능하신 분
 자사 B2B쇼핑몰컴퓨터코리아 개발 및 유지보수컴퓨터코리아wwwcomputercokr 신규 사이트 개발 업무, PHP MySQL MSSQL 개발 가능하신 분 쇼핑몰 제휴사 API연동 경험 HTML javascript CSS 해외여행출장에 결격사유가 없는 분 쇼핑몰 상품 및 주문관리 개발 경험 내부 관리자 사이트 관리 경험 웹프로그래밍 경험 정보처리 계열 자격증
 자사 정보보안 솔루션 Java 로 개발, 경력  자바 개발 경력 최소 만 3년이상  9년 미만 학력  초대졸 이상 관련학과 전공자 SW공학 컴퓨터공학 전산학 정보통신공학 등 자바 spring 웹 개발 경험 mysql 사용 개발 경험 elsticsearch opensearch 연동 개발 경험 네트워크 보안지식 보유 가상 환경 사용 경험 docker
 3차원 머신비전 솔루션 데스크탑 앱을 개발하고 유지보수합니다 Windows 3차원 카메라 조작 앱을 개발하고 유지보수합니다 WindowsLinuxMacOS 3차원 카메라를 활용한 새로운 데스크탑 앱을 개발합니다 WindowsLinuxMacOS어떻게 성장할 수 있나요높은 성능과 안정성을 요구하는 곳에서는 여전히 데스크탑 앱에 대한 수요가 높습니다 또한 응용분야와 산업 별로 요구하는 플랫폼이 다르기 때문에 저희는 기본적으로 크로스플랫폼 개발을 지향합니다주식회사 클레와 함께 하시면 높은 성능과 안정성을 갖춘 데스크탑 앱을 다양한 플랫폼으로 배포 가능한 개발자로 성장하실 수 있습니다 또한 클레의 응용분야는 컴퓨터비전 인공지능 머신러닝 메타버스 등입니다 함께 개발 프로젝트를 진행하면 이와 같이 요즘 핫한 분야에 대한 경험과 지식을 습득하실 수 있습니다,과 맞지 않더라도 본인이 자신 있는 프로그래밍 언어 하나는 있어야 합니다 새로운 것을 배우는 데 두려움이 없어야 합니다 다양한 직군과의 원활한 의사소통 및 협업 능력이 있어야 합니다 자기 주도적으로 개발하며 스스로 동기부여할 수 있어야 합니다 기술스택에 있는 언어나 프레임워크를 다뤄본 경험이 있으면 좋습니다 데스크탑 앱을 개발해본 경험이 있으면 좋습니다 공장자동화 관련 개발을 해본 경험이 있으면 좋습니다 PLC 로봇 등 컴퓨터비전 관련 개발을 해본 경험이 있으면 좋습니다 영문 자료를 참고하고 해외 커뮤니티에서 소통하며 문제를 해결할 수 있는 영어 실력이 있으면 좋습니다 Git 을 사용할 줄 알면 좋습니다
자사 스마트HMI 스마트SCADA 웹 어플리케이션 개발웹 브라우저를 이용한 모니터링 및  제어 시스템 개발React Nextjs를 이용한 프론트엔드 개발Node Redis를 이용한 백엔드 개발,대학 4년제 이상경력 3년7년소프트웨어 컴퓨터 정보통신 관련 전공자웹 프론트엔드 백엔드 개발 가능한 자React Nodejs 개발 경험UXUI 설계 및 개발 가능하신 분API 설계 및 개발 가능하신 분
FrontEnd 디지털마케팅 자동화 플랫폼 개발 내부 컴포넌트 개발 및 업무 요건 구현 생산성을 높이기 위한 개발환경 개선 Short Term48주 주기 개발 Project의 계획 및 실행 사용자비즈니스 요구사항에 대한 이해를 바탕으로 개발 지속적인 모니터링으로 Product의 개선 방향 제시 및 진행 장애 발생 시 빠른 대처와 처리 방안 수립 및 개선, 도입에 적극적인 분 디지털마케팅 분야에 관심이 있거나 경험이 있는 분 포트폴리오 및 git 제출한 분
